text,admiration,amusement,gratitude,love,pride,relief,remorse
Is this in New Orleans?? I really feel like this is New Orleans.,0.010040835477411747,0.0038235406391322613,0.0005471798358485103,0.006410794332623482,0.001129891723394394,0.0013566729612648487,0.0005642257747240365
"You know the answer man, you are programmed to capture those codes they send you, don’t avoid them!",0.015124881640076637,0.0009598141186870635,0.0030153277330100536,0.0011597416596487164,0.0026490779127925634,0.003094671992585063,0.0010946821421384811
"The economy is heavily controlled and subsidized by the government. In any case, I was poking at the lack of nuance in US politics today",0.0028126435354351997,0.020401429384946823,0.0018673127051442862,0.0006190753192640841,0.0009099342860281467,0.0011464827693998814,0.005146821029484272
"Thank you for your vote of confidence, but we statistically can't get to 10 wins.",0.009593798778951168,0.007509173825383186,0.9978228807449341,0.004759728908538818,0.0017989195184782147,0.0060429698787629604,0.0056077465415000916
There it is!,0.008057851344347,0.0012117414735257626,0.0018688561394810677,0.0019167627906426787,0.0011992205400019884,0.0010722276056185365,0.0008802312659099698
It's better to say a moment like that could truly ignite her love for the game rather than putting a bit of a damper on it.,0.0581568107008934,0.0026145493611693382,0.0050478968769311905,0.9791951179504395,0.0025694523938000202,0.002926139160990715,0.001406260533258319
Like this just cuz of the [NAME] rhymes background raps...but dude your [NAME] is sick against [NAME],0.029419494792819023,0.4350714385509491,0.0006539869355037808,0.004822045564651489,0.001237808377481997,0.0019092034781351686,0.00028716985252685845
Lol dream on buddy. You’ve had enough attention today. Actually learn what your talking about helps a lot. Sorry your stuck in free roam smokin crack,0.022932181134819984,0.9878986477851868,0.08097657561302185,0.009151224046945572,0.006783211138099432,0.013352327048778534,0.8569135069847107
"Did you hear the reason for this? Because they are concerned about inventory, initially. ",0.0020186584442853928,0.001989729469642043,0.003923133015632629,0.0011975722154602408,0.000861968903336674,0.0017113920766860247,0.005808730144053698
[NAME] is such a legendary daddy 😩,0.9915738701820374,0.021645227447152138,0.009307537227869034,0.010154788382351398,0.014352724887430668,0.0028951256535947323,0.0013002872001379728
"downvoted to hell but i understand your experience. salute, soldier.",0.873127818107605,0.009785441681742668,0.02818259410560131,0.0043088821694254875,0.19090135395526886,0.012046031653881073,0.004958844278007746
Say that you like her,0.01851017028093338,0.0020173562224954367,0.0012308594305068254,0.4186735153198242,0.000791730300989002,0.0008010471356101334,0.0004893966834060848
BLOCK BLOCK BLOCK his ass!,0.004527451936155558,0.003053039778023958,0.0017944213468581438,0.0009447748307138681,0.0011246743379160762,0.0015896048862487078,0.0013221872504800558
"oh shoot, im sorry to hear that. was it someone close to you? ",0.03901693969964981,0.024098267778754234,0.08336639404296875,0.014717291109263897,0.011085737496614456,0.01811227574944496,0.9965147376060486
"I'm a dudes, he's a dudes, she's a dudes, we're all dudes!",0.11084092408418655,0.0028198587242513895,0.0010242220014333725,0.0019292734796181321,0.005059105344116688,0.0013770760269835591,0.00046521241893060505
Thank you. I really appreciate your response,0.5410938858985901,0.003980915993452072,0.9976063966751099,0.007571248337626457,0.0038243765011429787,0.004399123135954142,0.005966903641819954
Kawhi and Siakam chemistry,0.015463241375982761,0.0017634000396355987,0.0030164173804223537,0.0017322971252724528,0.0006702885730192065,0.0011541618732735515,0.0008937082602642477
This thing going to be a boon doggle. The last thing NJ needs is another mall.,0.005788684356957674,0.0021347030997276306,0.003638001624494791,0.0007097464404068887,0.001270936569198966,0.004166994243860245,0.0016437671147286892
"I checked the dudes profile before I posted this, it’s not he’s being serious ",0.0039856587536633015,0.0022815491538494825,0.0035993712954223156,0.0015597377205267549,0.0018830649787560105,0.004092852119356394,0.0063836039043962955
"Oh dear, The combination of drugs, alcohol and a cell phone has caused many regrets. ",0.0385807566344738,0.020581556484103203,0.08047692477703094,0.031123174354434013,0.020710298791527748,0.025495748966932297,0.9962722063064575
At least it’s not malk,0.016589272767305374,0.007787857670336962,0.02957967296242714,0.0024118321016430855,0.014535368420183659,0.32465800642967224,0.017664682120084763
"Your 'brother' had texted alot of girls and ended up on in Internet many times then, what a celebrity! Did everyone clap as well? ",0.2023705095052719,0.006486997473984957,0.0016272368375211954,0.0010732220252975821,0.0010773445246741176,0.0008961824350990355,0.00023448903812095523
Lots of them to mature. Thank you for half baked?,0.01939157024025917,0.008383112959563732,0.9979422688484192,0.006378210615366697,0.0018253782764077187,0.0066658263094723225,0.002405706560239196
Only 5 hour drive..... I guess im doing a day trip to Almonte. I love baked goods.,0.06469862908124924,0.0128068458288908,0.010089471936225891,0.9970914125442505,0.0038197143003344536,0.006398892495781183,0.0034324589651077986
Thank you for this! FA and the draft are exciting again - cool.,0.12838587164878845,0.007628707680851221,0.9985950589179993,0.0028830557130277157,0.002646791283041239,0.01607419177889824,0.0026463707908988
You're right. Sorry for the poor reply.,0.059752482920885086,0.03266580402851105,0.11482880264520645,0.01257217489182949,0.010293595492839813,0.017613405361771584,0.9969249367713928
"Unfortunately, we do not routinely keep 20 liters of fentanyl in the pharmacy,",0.0025988828856498003,0.001987978583201766,0.021486276760697365,0.001559048774652183,0.002364340703934431,0.006745289545506239,0.0724557563662529
They could've added two dots and a line and it could have been better,0.008283485658466816,0.0039035212248563766,0.002681790152564645,0.00053509691497311,0.0006962615298107266,0.001648042700253427,0.0010356880957260728
And then [NAME] missing a WIDE OPEN corner 3,0.0017948535969480872,0.0029724538326263428,0.002759344642981887,0.0012389984913170338,0.0007124259718693793,0.0014042617985978723,0.0050433725118637085
3 weeks or so' away from her kid for some 'alone time'? I feel sorry for that kid.,0.05471576750278473,0.031966011971235275,0.09650745987892151,0.025844743475317955,0.016206329688429832,0.020300185307860374,0.9974451065063477
"Wow, out of all of that, only one person mentioned helping parents because they loved their parents. SAD.",0.2767532467842102,0.005439344793558121,0.001567808911204338,0.940121591091156,0.0012935829581692815,0.0015968704828992486,0.0009719682275317609
"I am confused. I don't understand how that relates to what I said. Could you explain? Sorry, maybe I'm just tired lol",0.018281297758221626,0.941711962223053,0.11791744083166122,0.010877581313252449,0.0071721067652106285,0.012733194045722485,0.96849524974823
"Ah, Farmville. Those were dark days.",0.002038306789472699,0.0034045856446027756,0.002244764007627964,0.0010383396875113249,0.0008858610526658595,0.0019247019663453102,0.0021264348179101944
"8,000 jobs created in Frankfurt. Such a bright future",0.9569491744041443,0.002557117259129882,0.00908059161156416,0.003198864171281457,0.002086923224851489,0.0018401045817881823,0.0008145816391333938
"Haha, love it! :)",0.07535664737224579,0.8729991912841797,0.017554689198732376,0.9897550940513611,0.00595035869628191,0.013240807689726353,0.003890956286340952
He has his ups and downs. The only time I can stand him is after [NAME] and before [NAME],0.05474195256829262,0.0008925058646127582,0.0019912405405193567,0.0028989040292799473,0.0037525780498981476,0.0016842825571075082,0.000587098824325949
My favourite moment of the game by my favourite player.,0.21125414967536926,0.0027893756050616503,0.01826528273522854,0.9845682382583618,0.011127515695989132,0.0027425598818808794,0.002173215849325061
You must be new around here.,0.0034434946719557047,0.002737979404628277,0.0023757764138281345,0.0008038082160055637,0.0008550345664843917,0.0012953417608514428,0.003317865775898099
This is either beautiful..or just about the stupidest thing I've read in weeks. Here's hoping for fantastic satire!,0.9895018935203552,0.018732938915491104,0.009165901690721512,0.003453172044828534,0.004456405062228441,0.00260554114356637,0.0014090086333453655
I would not bother. He read your message and did not reply yet. So that's already a bad sign and not a good start.,0.0023383318912237883,0.001184449647553265,0.010364281944930553,0.0014541944256052375,0.0019773957319557667,0.008371573872864246,0.03324158489704132
She's slept with so many guys she's starting to look like one,0.013381896540522575,0.011842714622616768,0.00048346066614612937,0.0017341782804578543,0.0005685553187504411,0.0007839548052288592,0.000493224011734128
"Maybe [NAME] would be like Old [NAME], jaded by a lifetime of tricking women into bed. ",0.0033276299946010113,0.005988121964037418,0.0018813889473676682,0.001273486064746976,0.0005654044798575342,0.0011697181034833193,0.0010935397585853934
> Crown Four Kingdoms thank you man :),0.008085564710199833,0.00782299879938364,0.997912585735321,0.006584601476788521,0.0021676537580788136,0.007716058287769556,0.004406902939081192
This is how mafia works,0.007376417983323336,0.002484200755134225,0.002106055850163102,0.0007522631203755736,0.0006401241989806294,0.0010636505903676152,0.001369813340716064
True Story.,0.15024888515472412,0.0007047178805805743,0.006267116405069828,0.0019054707372561097,0.003262703772634268,0.0016433045966550708,0.0012687902199104428
Yikes. I admire your patience,0.9936133027076721,0.008388029411435127,0.03214703127741814,0.010505802929401398,0.010586674325168133,0.0036105900071561337,0.002394299255684018
*scoff* maybe you can’t. /s,0.002245897427201271,0.0026072259061038494,0.0022278279066085815,0.00120057153981179,0.0007786894566379488,0.0014548259787261486,0.002245783107355237
"Hahahah thank you so much, username does not check out, you don't seem sketchy at all! 😅",0.025829272344708443,0.9601604342460632,0.9908229112625122,0.01881842501461506,0.0077101094648242,0.032856058329343796,0.014172160066664219
"I love Wood Witch, still saving to buy that.",0.14123179018497467,0.0056372396647930145,0.008370889350771904,0.9966000914573669,0.005686904303729534,0.006045304238796234,0.0026746413204818964
Why should [NAME] get to pick the Democratic party candidate?,0.002573861740529537,0.003963525407016277,0.0020491029135882854,0.001053258078172803,0.0006087793153710663,0.0011685102945193648,0.001606744364835322
"Oh dear, you are entertaining. Please, talk more to me. ",0.880516529083252,0.9664580225944519,0.018143080174922943,0.01779887080192566,0.004268394783139229,0.007779932115226984,0.0011710162507370114
"Interesting, thanks for the article, guess they're just as bad!",0.20489907264709473,0.006502550560981035,0.998408854007721,0.0031059833709150553,0.0022670330945402384,0.007724459748715162,0.005548272281885147
"big heart to do that, guy probably plays for the love of the game, and you have to respect that",0.7460997104644775,0.0012975699501112103,0.0035885062534362078,0.7698469758033752,0.014506981708109379,0.0018504902254790068,0.0007273859810084105
I hope you’re okay! I’m so sorry that happened. I’m glad I don’t work in gastown anymore,0.03936081752181053,0.010094993747770786,0.835473895072937,0.01300913468003273,0.01702968217432499,0.3412880003452301,0.9317966103553772
Unblockable feint dodge light beats a roll on reaction to the unblockable.,0.010717594064772129,0.0017833716701716185,0.0026591112837195396,0.0006358756800182164,0.0012196851894259453,0.001896667294204235,0.001373552717268467
I mean going on a dating show when you have a girlfriend though,0.0019963260274380445,0.0051626418717205524,0.0012564031640067697,0.006399550475180149,0.0005380723159760237,0.0008398636127822101,0.0019746979232877493
"[NAME] is having a hard time moving on. [NAME] need to cash in with AD before the trade deadline, because his value is going down after this season.",0.0021288807038217783,0.0037693078629672527,0.002407971303910017,0.0009080392774194479,0.0006393519579432905,0.0012911868980154395,0.006131318397819996
"Modern example about [NAME]' genocide against [NAME]. Mosques burned, civilians murdered in a mass etc etc ",0.002973462687805295,0.004049306269735098,0.0020067119039595127,0.0010619456879794598,0.0006514913984574378,0.0010677030077204108,0.002139372518286109
Where about sis this it’s gorgeous. I’d love to have a piece of property with a creek. That’s my dream.,0.9400345683097839,0.009013117291033268,0.004741206299513578,0.9527149200439453,0.005650585051625967,0.00335879810154438,0.0011890239547938108
"Fiend! Take a good look at this silver cross, for it will be last thing you'll see of me and [NAME]!",0.4233032464981079,0.002845546929165721,0.004962242674082518,0.0010204317513853312,0.001840003882534802,0.0018071722006425261,0.00038833182770758867
This actually made me squeal like a little girl! Thats awesome!!!! Im so happy!,0.9964775443077087,0.04761849343776703,0.04188177362084389,0.005755145102739334,0.012598881497979164,0.006427502725273371,0.002274502534419298
So true! I’ve always wondered why this is? I’m skinny as all hell and ppl tell me this all the time lol.,0.010637997649610043,0.9971626400947571,0.009277330711483955,0.005326785612851381,0.002930411836132407,0.006029034033417702,0.004664571490138769
It’s all a show. Welcome to season one of tanking in the Windy City.,0.0373871773481369,0.006394152995198965,0.9814034700393677,0.0013996094930917025,0.0012515427079051733,0.004712579771876335,0.001799730584025383
He's gotta be a robot or a test tube baby. Only explanation.,0.002911505289375782,0.0031693216878920794,0.005953094456344843,0.0005268053500913084,0.0009475215338170528,0.0020599616691470146,0.006942272651940584
try going outside for a long painful walk,0.0016393898986279964,0.0053596799261868,0.0028063179925084114,0.0016289319610223174,0.0007207682938314974,0.0015758068766444921,0.0050224484875798225
It should be played between two biggest NCAA violators of the year as a punishment.,0.001752718584612012,0.011233576573431492,0.002130162436515093,0.0010817538714036345,0.0007217711536213756,0.0010765144834294915,0.007278837263584137
"Well, I can't speak for the right; I'm on the left.",0.002478690119460225,0.0014180513098835945,0.0031544319353997707,0.0015766766155138612,0.0021323144901543856,0.0033047569449990988,0.0031667540315538645
"If you leave religious pamphlets that look like money instead of a tip, *you're about* ***meet*** *[NAME]...*",0.002752756467089057,0.00422150082886219,0.0011861060047522187,0.002235051477327943,0.0006962190382182598,0.000984038459137082,0.0009333827765658498
"ok, thanks pal",0.011608720757067204,0.009134449996054173,0.9985514283180237,0.0077451299875974655,0.002291623502969742,0.005714071914553642,0.008326493203639984
Lmao that’s so true,0.03287466987967491,0.9964675903320312,0.005635462701320648,0.008322123438119888,0.0033038132824003696,0.00657645333558321,0.0030428592581301928
"Yeah, I actually do really like the TD Centre. Love walking around on (non bone chilling Saturday's) and just admiring the city.",0.4652942717075348,0.009711410850286484,0.006669054739177227,0.993728518486023,0.002895809942856431,0.0035765604116022587,0.0015597897581756115
Growing up in Chicago this was my life. Pissed he didn’t make it.,0.009415377862751484,0.009928756393492222,0.002101376187056303,0.0028067557141184807,0.009571307338774204,0.0036788410507142544,0.07301773130893707
Send it!,0.002358373487368226,0.0009632743312977254,0.00837712548673153,0.00539285596460104,0.001082374481484294,0.0012908733915537596,0.0023125074803829193
Pm me too please!,0.0017381020588800311,0.0021155865397304296,0.004751694388687611,0.015258893370628357,0.0011756249004974961,0.0013915806775912642,0.0013727948535233736
"Skittlez, I'm really proud of you. She's been jerking you around for ages! Stay strong, honey, you got this!",0.8848468065261841,0.09980415552854538,0.2867106795310974,0.09878683090209961,0.9610787034034729,0.1382753998041153,0.07720436900854111
"Seems like the driver in the video car had plenty of time to react and slow down, they just chose not to and overreacted. ",0.002789801685139537,0.0021585975773632526,0.003097107633948326,0.0007332271779887378,0.0009296138887293637,0.0021544594783335924,0.004320936277508736
We riot if he doesn’t get it!,0.0017774412408471107,0.00692569836974144,0.0015189745463430882,0.001544617465697229,0.0008536799577996135,0.0014940055552870035,0.0021748512517660856
Any response helps and makes me feel like I’m not alone....thank you❤️,0.011357221752405167,0.008811200968921185,0.9987465143203735,0.0076407636515796185,0.004529775585979223,0.03656673803925514,0.011362357065081596
The first story in the history of humanity.,0.03996868431568146,0.001795771298930049,0.0026912586763501167,0.0005359299248084426,0.0013604369014501572,0.0012034751707687974,0.001349623198620975
You’re* such a nice person!,0.9939684867858887,0.0058664120733737946,0.023729903623461723,0.0068425326608121395,0.009597492404282093,0.0031117068137973547,0.0016884183278307319
It's almost like OP is the real CB trying to make fun of people to get them mad and then screenshot it for karma,0.008774126879870892,0.912814199924469,0.0019055523443967104,0.00135887844953686,0.0007834727875888348,0.0018655573949217796,0.0010783661855384707
"Perhaps not a mainline souls game, but you can't deny the similarities to Soulsborne games. It's basically an iteration on the formula. ",0.012067154049873352,0.0025220478419214487,0.0023385377135127783,0.0008904600399546325,0.0007752599194645882,0.0013858929742127657,0.0012269433354958892
Current use could also mean setting pills in a weekly pill box for use each day.,0.0025502184871584177,0.0037865997292101383,0.0032778270542621613,0.0013848334783688188,0.000680506054777652,0.0014530939515680075,0.0038359351456165314
He looks like his parents are blood related.,0.11246735602617264,0.0062060486525297165,0.000964385864790529,0.0012213889276608825,0.0015405942685902119,0.00102844403591007,0.00042091793147847056
When she drilled into the table [NAME] didn’t even know they were sleeping together. Her complaint should’ve been filed with Arizona.,0.0018907045014202595,0.00766604533419013,0.0018670620629563928,0.0008506272570230067,0.0006949336966499686,0.0011347623076289892,0.006695159245282412
Damn so the Patriots are gonna get thielen after all,0.013535465113818645,0.0032725436612963676,0.0072987861931324005,0.0006929308292455971,0.0017342937644571066,0.010470079258084297,0.0008387683192268014
Lions fan.... Thanks for the beer. It's the first thing I've ever won.,0.023898355662822723,0.01566525176167488,0.9988164901733398,0.006445268169045448,0.002977857133373618,0.006574082653969526,0.004457503091543913
His smile and optimism: gone.,0.05786924436688423,0.003746181959286332,0.0028395294211804867,0.004314268007874489,0.0017094388604164124,0.002618871396407485,0.000382147787604481
OMG. This is such a great point!,0.993316113948822,0.009973921813070774,0.055990997701883316,0.003093021921813488,0.005998339504003525,0.003764905733987689,0.002893070224672556
"Or, drag an old pallet jack outside, empty. ",0.0018284486141055822,0.003855768358334899,0.0024660092312842607,0.00154137855861336,0.000763413030654192,0.0014985307352617383,0.002186700701713562
"wE mODiFieD eiGHT viDEo CaRds tO fIt iN A SinGLe pciE sLoT /squeak Whoops, sorry, wrong [NAME].",0.028400635346770287,0.024268241599202156,0.08230900019407272,0.01013514120131731,0.008741115219891071,0.01439450029283762,0.9957210421562195
(4) Fufill sexual pleasures,0.0020480977836996317,0.004355861339718103,0.002711621578782797,0.002408465137705207,0.0009051351808011532,0.0014626717893406749,0.0013887539971619844
I just need [NAME] to retire already so I can stop hating on him and appreciate all he's done... Even if it has caused me great suffering.,0.9841558933258057,0.002974622417241335,0.39956390857696533,0.003135905833914876,0.04571098834276199,0.009704094380140305,0.006411331705749035
whats on his story? I dont have insta,0.001185351051390171,0.005108988378196955,0.0028072816785424948,0.001200399361550808,0.0011273302370682359,0.0029556099325418472,0.007510161958634853
"If wishes were horses, beggars would ride.",0.0026925066486001015,0.0025724151637405157,0.0020272028632462025,0.0020372935105115175,0.0006587617681361735,0.0011096748057752848,0.001020267023704946
[NAME] is staying where he is thank you very much,0.014208621345460415,0.006776406895369291,0.998195230960846,0.005953771993517876,0.0021819169633090496,0.0060110390186309814,0.004106944426894188
because he gets fouled 70% of the time with no call,0.00250189914368093,0.003877348033711314,0.0020512589253485203,0.0010845703072845936,0.0006465830956585705,0.0011611322406679392,0.003936345688998699
Nobody's mad at incels for being in pain. We're mad at them for letting that pain calcify into hate.,0.010424348525702953,0.0012793689966201782,0.0020945181604474783,0.001566798542626202,0.002222031122073531,0.0021839349064975977,0.0010514190653339028
"OK, thanks.",0.012415415607392788,0.00978957861661911,0.9985895752906799,0.008632976561784744,0.002269693184643984,0.005065253470093012,0.008927987888455391
4 year old. The hardest part is only seeing him half the time bc I’m the primary care giver in the family,0.02391570247709751,0.0024683962110430002,0.0020070290192961693,0.0028609815053641796,0.0073529998771846294,0.005279142409563065,0.004042241256684065
> no child should go without needed medical care. Or adult.,0.0029097769875079393,0.002516654320061207,0.0018024258315563202,0.0016221373807638884,0.0011013939511030912,0.0020009286236017942,0.0015436470275744796
Man I love Canada🇨🇦,0.055934786796569824,0.01407536119222641,0.016544368118047714,0.9977008700370789,0.0056013683788478374,0.008959941565990448,0.005262539256364107
"[NAME]. Get off of the computer my man. Get some fresh air, there’s a whole world out there. ⛑",0.014446685090661049,0.020647382363677025,0.00044877800974063575,0.006663232110440731,0.0010198937961831689,0.0011977872345596552,0.0004242827417328954
What do you mean when you say picking a side of history,0.0030445752199739218,0.00543229142203927,0.0016747501213103533,0.001131966128014028,0.0005432500620372593,0.000898420752491802,0.0015351723413914442
Wow. [NAME] is gonna lose CO by double digits,0.8384652137756348,0.1733691543340683,0.002156006870791316,0.0008519900147803128,0.0021574138663709164,0.0025176911149173975,0.0012442778097465634
Thank you!,0.010159683413803577,0.008164843544363976,0.9982036352157593,0.006956785451620817,0.0018718036590144038,0.005316250491887331,0.007692137733101845
Hard to get motivated to play when the fans are burying one of your teammates.,0.0041490644216537476,0.001293680863454938,0.0018522992031648755,0.0014301626943051815,0.0015585367800667882,0.0018365338910371065,0.005849685985594988
"You can be partners without being codependant, you can also keep your individuality without worrying or hurting your relationship. Its all about communication.",0.012114969082176685,0.0006867143674753606,0.002863767324015498,0.0026024102699011564,0.0034719903487712145,0.003866596845909953,0.000793201383203268
Lol I bet you actually believe that too,0.016689585521817207,0.9974725842475891,0.011465656571090221,0.00599411316215992,0.0026253073010593653,0.0054792980663478374,0.003994867205619812
Thank you and likewise to you friend!,0.01138882152736187,0.0081431670114398,0.9983454942703247,0.01019210834056139,0.0019606684800237417,0.00504089193418622,0.006563312839716673
just say whore.,0.0015066041378304362,0.006046298425644636,0.0023370685521513224,0.002247603377327323,0.0005992291262373328,0.0010355972917750478,0.0022267659660428762
"Damn it [NAME], now I have to go down there again.",0.0038265336770564318,0.008041251450777054,0.0015986543148756027,0.00085377914365381,0.002108511747792363,0.001952511491253972,0.009399136528372765
Source leads to artist’s Twitter page and post :3,0.0039754593744874,0.0014363484224304557,0.005962600000202656,0.0017666093772277236,0.0009455573745071888,0.0010472533758729696,0.0027289092540740967
That's pretty gross. Unlucky OP.,0.9029579162597656,0.16324225068092346,0.010972102172672749,0.0007445297087542713,0.002041321713477373,0.0031561660580337048,0.005223627667874098
Good job homie 👍🏻,0.9930340051651001,0.004314069636166096,0.11589699983596802,0.004961948376148939,0.007573351729661226,0.004759419709444046,0.002387576038017869
"Didn't know she was a life long canucks fan, or alive in the 70s. Looks really young for her age",0.8817287087440491,0.005747090559452772,0.003866515588015318,0.0022670342586934566,0.004385998006910086,0.00172453373670578,0.0009720923262648284
"This is so hard to sit through, I can't believe the swearing from this dood, it makes it all the more unbearable",0.012454701587557793,0.08981303870677948,0.0018033371306955814,0.0014948948519304395,0.001383950817398727,0.002368414541706443,0.02367420122027397
tell him i love him,0.03573949635028839,0.01102313119918108,0.014550264924764633,0.9961075186729431,0.0038645050954073668,0.006125974003225565,0.004071676637977362
oh trae turnover then a whistle looks like LP gonna show him the bench :|,0.006009044591337442,0.02099926769733429,0.001091596088372171,0.0014901806134730577,0.0009257989004254341,0.001298405579291284,0.0003747827431652695
"Ok cool, thanks",0.022789660841226578,0.008070617914199829,0.9987509250640869,0.004420199431478977,0.002460357267409563,0.007532223593443632,0.004644494969397783
