text,admiration,amusement,gratitude,love,pride,relief,remorse
It's catdog's parents,0.002767286729067564,0.0027851066552102566,0.001829642103984952,0.0015566168585792184,0.0007763636531308293,0.0011481110705062747,0.0011009800946339965
"**TELESTRATE, YOU BEAUTIFUL MAN!**",0.9929448962211609,0.004240274429321289,0.023270728066563606,0.009902335703372955,0.01040482334792614,0.002383479615673423,0.0016639955574646592
no u again,0.002138654002919793,0.001887055579572916,0.0033904246520251036,0.003221008228138089,0.0010881158523261547,0.0018197422614321113,0.002715624636039138
That's literally the science of it.,0.13010883331298828,0.0058461762964725494,0.0023783035576343536,0.00042379522346891463,0.001539224642328918,0.0013210438191890717,0.0011156565742567182
Careful we don’t talk about that here. I’m enjoying a ban from LegalAdvice lmao,0.005146745592355728,0.9809821844100952,0.0061247749254107475,0.004450035747140646,0.0038804158102720976,0.019166534766554832,0.007271697744727135
I love those examples. Thank you for sharing. 🙏,0.09205208718776703,0.033576902002096176,0.9670671224594116,0.9865346550941467,0.007840228267014027,0.018497735261917114,0.01269506011158228
Hurr durr! Just take a shower and lift bro!,0.0038143147248774767,0.09383826702833176,0.0020747268572449684,0.0028039917815476656,0.001026273239403963,0.007258488330990076,0.0004981926758773625
There’s some Rask sparks!,0.01887875609099865,0.005245306063443422,0.0012355514336377382,0.0013150488957762718,0.0005641037132591009,0.0011590862413868308,0.0003719970118254423
"I just heard about this, its pretty cool. ",0.9886307716369629,0.011879067867994308,0.05393718555569649,0.003387573640793562,0.014412079937756062,0.05738576501607895,0.0040223728865385056
"I actually did just after writing it hope the poster doesn't mind, but just so you can find ",0.0030211720149964094,0.0011541289277374744,0.017408985644578934,0.007164677605032921,0.005498671904206276,0.011144071817398071,0.003076863009482622
You have selected POWER DRIVE,0.013806292787194252,0.0008433749317191541,0.004262782633304596,0.002344562904909253,0.0019144981633871794,0.0011834414908662438,0.0006951035466045141
"Well now we know how [NAME] and [NAME] lip syncs did lol. [NAME] is overthinking it, and have the second photo looks nothing like her?",0.00985780730843544,0.9927645325660706,0.004846976138651371,0.003254806390032172,0.0017591386567801237,0.0038216779939830303,0.0025458349846303463
"[NAME] is the queen. The dispossessed is a great work of anarchist science fiction, and where I first came across anarchism portrayed positively.",0.9831002950668335,0.004879456013441086,0.01109489519149065,0.002679196186363697,0.006865224335342646,0.0022905010264366865,0.00137037830427289
[NAME] at 2.38 against Moicano seems like excellent value for me,0.9870584607124329,0.005503594409674406,0.03136668726801872,0.0030833054333925247,0.009317888878285885,0.00292140431702137,0.0013381082098931074
Guys don’t typically pick up random women at night unless it’s a prostitute.,0.0030575378332287073,0.0020308364182710648,0.002103431150317192,0.0012435942189767957,0.0009568749810568988,0.0018271028529852629,0.00226897862739861
Hahah I’ll try and hop on after this basketball game. Hopefully around 7,0.011867677792906761,0.995484471321106,0.008344742469489574,0.0035998655948787928,0.002470719860866666,0.006771784275770187,0.0028141350485384464
#BHAW!,0.003835224313661456,0.0038808619137853384,0.0018169673858210444,0.0020146756432950497,0.0007898114272393286,0.001074378378689289,0.0006702968385070562
Its like if i decapitated myself while shaving.,0.0021289768628776073,0.006518854293972254,0.0012607061071321368,0.0019402678590267897,0.0005416782223619521,0.0008689930546097457,0.0016157404752448201
The emojis in the background. Wtf lmao,0.003021838376298547,0.9121477603912354,0.0022774541284888983,0.0019714292138814926,0.0008513724897056818,0.0021863689180463552,0.0017903236439451575
It's shaped fine. It fits her. It looks great and I'm jealous.,0.9914681911468506,0.010302025824785233,0.009530440904200077,0.007541164290159941,0.008928578346967697,0.0029172864742577076,0.0014057670487090945
"Umm, but I got to a Barber Shop that has more female barbers than men....",0.0013870754046365619,0.004286988638341427,0.002463666722178459,0.0016241503180935979,0.0015952771063894033,0.0037730305921286345,0.009300390258431435
Last year was Celtics and Sixers... that’s pretty decent,0.9901793003082275,0.006055696401745081,0.04573069140315056,0.0020721505861729383,0.006955829914659262,0.005178472027182579,0.002059630351141095
Keep asking. Mine turned around eventually.,0.0011393374297767878,0.0034765140153467655,0.00966017134487629,0.0026721442118287086,0.0016079166671261191,0.00514781242236495,0.002206555102020502
I was in Amsterdam two weeks ago and 400 sq ft apartments were renting for 1800 euros a month in the city. They have density but no affordability.,0.0026116129010915756,0.0027444828301668167,0.0016647435259073973,0.0012810516636818647,0.00105752469971776,0.0013574426993727684,0.002077684737741947
Gotta go fast! [NAME],0.10480454564094543,0.006252196617424488,0.0052672442980110645,0.000767550605814904,0.001956455409526825,0.001571468310430646,0.0004194713255856186
Because a bunch a boys r lookin,0.004515308421105146,0.04522750526666641,0.0008361528161913157,0.0013064630329608917,0.0005023597041144967,0.0008122923318296671,0.0006380879203788936
"Thank you so much for saying all this, it needs to be heard more often. ",0.00925365462899208,0.006087516434490681,0.9982295632362366,0.0058310613967478275,0.0019548889249563217,0.006844519637525082,0.008036505430936813
What ribs lmao,0.012754876166582108,0.9896454811096191,0.0033265657257288694,0.004967738874256611,0.0016526506515219808,0.003218919038772583,0.0020636417903006077
"Because they want to believe [NAME] is a man, despite them claiming that [NAME] is no man..?",0.002920775208622217,0.003463020082563162,0.0018052214290946722,0.0015313734766095877,0.000656727293971926,0.001051108120009303,0.0013162994291633368
Everyone just called me the bad guy and said they're glad she's marrying him and rejected me and that i deserved it.,0.2677614092826843,0.008376111276447773,0.7168943881988525,0.004163614008575678,0.04240241274237633,0.5778383016586304,0.003773096948862076
[NAME] had talked about this entire operation is shady with an anti abortion agenda that's hidden behind their intentionally misleading name.,0.002254999242722988,0.024690143764019012,0.0017110522603616118,0.0008916269289329648,0.0004694004892371595,0.0008674617274664342,0.0017961509292945266
"And of course, instead of calling out the men responsible for this behavior, the ""Not all men"" crowd has arrived in full force.",0.003641268005594611,0.0011064085410907865,0.005371780600398779,0.0009658985654823482,0.0018037974368780851,0.004358339123427868,0.003258549142628908
"LOL thats right, your wait for someone to hand everything to you. LOL",0.010198060423135757,0.996359646320343,0.00859442725777626,0.004452235531061888,0.0023268612567335367,0.0045537762343883514,0.0040861498564481735
"Not interested. Old, slow, not a scheme fit.",0.0020299493335187435,0.001927780220285058,0.0029463362880051136,0.0011294236173853278,0.0009017431293614209,0.0016582482494413853,0.004307268187403679
"he left his briefcase... hey, it's full of shredded newspaper!",0.001923260628245771,0.00347261899150908,0.002331510651856661,0.001178498612716794,0.0009295306517742574,0.0015817297389730811,0.004001119639724493
Thanks 💙 ice skating is also one of my favourite non-food fun things to do 😉,0.06356006860733032,0.6007445454597473,0.9982916712760925,0.10994898527860641,0.006172541994601488,0.012640461325645447,0.008131244219839573
Hey beautiful! Glad you had a great time!,0.9920819997787476,0.0037088613025844097,0.3927609920501709,0.004581064451485872,0.007325476035475731,0.005853208713233471,0.0019846586510539055
The Guy just wanted to Make a Joke and I liked it,0.3991076648235321,0.41605567932128906,0.002920697443187237,0.9425060153007507,0.0020848438143730164,0.0028483772184699774,0.0010942056542262435
"Youtube ""glitch through anything red dead online"" and filter to show videos from the last week. 😊",0.0038091796450316906,0.01033972017467022,0.0009006904438138008,0.002981235273182392,0.0005787293193861842,0.0008026230498217046,0.001161470776423812
"Eh, we all pay for sex one way or another. More power to you.",0.02600555121898651,0.00124467967543751,0.003419644432142377,0.002629171824082732,0.0022821766324341297,0.001545025734230876,0.0003712406614795327
SIGN HIM UP,0.003204956417903304,0.002412377158179879,0.0028213325422257185,0.0021306765265762806,0.0007091474835760891,0.0011201831512153149,0.0010259930277243257
Muppet. Nice not obscene insult. Thanks.,0.07417689263820648,0.06668577343225479,0.9986129999160767,0.006296130828559399,0.0028169387951493263,0.0060244896449148655,0.0037117432802915573
This again?,0.0020278706215322018,0.004197593312710524,0.002494544954970479,0.0013296524994075298,0.0006611052085645497,0.0010812501423060894,0.002635172102600336
"Nice, I like it. A truly unusual pairing. ",0.9801002144813538,0.004023099318146706,0.012424289248883724,0.6805458068847656,0.0060158842243254185,0.003131421050056815,0.0018344363197684288
"On the contrary, he gets off on his own ego and the delusion shattering reality of intimacy with another person makes him limp as a wet noodle.",0.00268641603179276,0.004006004426628351,0.0015931233065202832,0.0010213704081252217,0.0009203096269629896,0.0022222723346203566,0.0024716800544410944
"Thank you for contributing your weird suggestion, I love it.",0.08885526657104492,0.02303292788565159,0.9888723492622375,0.9616410136222839,0.007181758992373943,0.015693025663495064,0.012033156119287014
"Same. After that it’s unbearable. Plus, [NAME] appears. So. ",0.0025759742129594088,0.003665815107524395,0.001901760813780129,0.0014085115399211645,0.0009483176982030272,0.0019363360479474068,0.0020856596529483795
[NAME] oh my god,0.011453501880168915,0.9121893048286438,0.00396166043356061,0.004563949070870876,0.0013075143797323108,0.0027016540989279747,0.004500496666878462
Works great until you sit down and burst the banana open.,0.9857729077339172,0.007605851162225008,0.03445027396082878,0.0015266932314261794,0.004081993829458952,0.004532208200544119,0.001558249001391232
Until you see another one you like lol,0.008466972969472408,0.9939035773277283,0.004864053335040808,0.012745194137096405,0.0015807653544470668,0.0033264330122619867,0.0022462927736341953
Make a great gag gift,0.9904987215995789,0.007706429343670607,0.079363152384758,0.0033265086822211742,0.003977351821959019,0.002603385830298066,0.0014140151906758547
"Great, about to rewrite my many ToDo lists",0.989425539970398,0.005971226375550032,0.042859647423028946,0.002188054844737053,0.0054916697554290295,0.003495363984256983,0.0025486056692898273
My favourite was “for people who don’t like water”. I don’t like their drinks but their advertising is always funny.,0.02580154873430729,0.9846171140670776,0.006177042610943317,0.40875059366226196,0.0025339454878121614,0.004807236138731241,0.001944742165505886
He looks normal. This entire post is a massive reach,0.9058083891868591,0.004085744731128216,0.007572814356535673,0.0008175938273780048,0.005138348322361708,0.005264886189252138,0.0010852927807718515
I watched that same movie. Very generic Christmas movie but I liked it,0.860079824924469,0.016748856753110886,0.0037354500964283943,0.9493218064308167,0.003544214181602001,0.0025744494050741196,0.0017165134195238352
that's fine also someone who shit their pants of realization,0.005386059172451496,0.002339070662856102,0.003871873253956437,0.0007826676010154188,0.002079386729747057,0.011400697752833366,0.0037198737263679504
Well the law trumps your feelings buddy,0.007244729902595282,0.0016911783022806048,0.0023538866080343723,0.0020176644902676344,0.0021594748832285404,0.0030782350804656744,0.0009054270922206342
I thought we traded away our losers like [NAME] and [NAME] already.,0.001538336044177413,0.0035470090806484222,0.0017997006652876735,0.0029586059972643852,0.0010665638837963343,0.001487745437771082,0.0020932056941092014
"Funny, I don't know a single MRA who's been accused of sexual assault... but I know plenty of feminists who have...",0.023423997685313225,0.9961674809455872,0.004620011430233717,0.007045143749564886,0.0025557433255016804,0.005344721022993326,0.002684583654627204
I really hope you do this for a living. Thanks!,0.015192658640444279,0.011685320176184177,0.9980356097221375,0.00785351824015379,0.0018924861215054989,0.003395963227376342,0.006854283157736063
"Would you recommend running/run another cycle if you knew you had all your ducks in a row so far as diet, training, and lifestyle go ??",0.0023948983289301395,0.005391318816691637,0.0021762517280876637,0.0016819422598928213,0.0005426285206340253,0.0011077013332396746,0.0010565685806795955
Lol naughty dog tattoo. Y’all done fuxked your reputation by letting your artist do this trash.,0.022320883348584175,0.9971445202827454,0.007036893162876368,0.005305076949298382,0.0033811614848673344,0.005438679363578558,0.004274872597306967
"this is beautiful !!! my poor baby tho, why is she crying ??? ;(( ",0.994817316532135,0.007933001033961773,0.015334876254200935,0.014778977259993553,0.007808880880475044,0.0033466375898569822,0.0019374450203031301
"U/scottgal - thank you! Coming from southern US, wanted to make sure!",0.006646138150244951,0.00972136203199625,0.9976256489753723,0.0078116487711668015,0.001695716753602028,0.00548590486869216,0.005912660621106625
"Someone did. The person who impregnated them. Humans don't reproduce asexually, you can't just make yourself pregnant",0.0076294695027172565,0.0012005160097032785,0.0024178456515073776,0.001515535986982286,0.0018484770553186536,0.0013307248009368777,0.0016246081795543432
They will get the other. It's all fun and games until they noticed I was friends with a deep trust issues with humans since they were little.,0.005975796841084957,0.9439820647239685,0.002531565260142088,0.001661650137975812,0.0011882438557222486,0.003102114424109459,0.001673367340117693
“Brave” is one way of describing it,0.6209269165992737,0.0033610621467232704,0.004041260574012995,0.0008981117862276733,0.004576192237436771,0.00131412991322577,0.0009839133126661181
Hi ex-methodist from another one!,0.002734747249633074,0.0021966060157865286,0.0020591961219906807,0.002174058696255088,0.000861713953781873,0.0013147658901289105,0.0012701657833531499
A thousand times this! I just found some of my old childhood stuff from the 80s with a 2 bar and it is fucking awesome.,0.9940177202224731,0.01598973385989666,0.015160074457526207,0.004341295920312405,0.008023280650377274,0.0040640863589942455,0.002188832499086857
"Anytime I've taken benzo beforecoke, it completely negates any coke feeling",0.004142771940678358,0.0015675520990043879,0.002056471072137356,0.0015464703319594264,0.0010705842869356275,0.0031567360274493694,0.001184362918138504
Figured since [NAME] is expiring and you guys are tanking it didn’t really matter,0.0065146684646606445,0.0024209863040596247,0.0035975950304418802,0.000772646046243608,0.0015899076825007796,0.005057063419371843,0.0008295761654153466
That would have been cool for sure,0.36495837569236755,0.02126864530146122,0.01806577481329441,0.001027956255711615,0.006299249362200499,0.11604059487581253,0.0011646636994555593
"As a guy who plays bastion when the situation appropriately calls for it; thanks, I did not know this.",0.014455167576670647,0.00486312061548233,0.9965289235115051,0.0038812453858554363,0.002411872148513794,0.004509548656642437,0.004306415561586618
"Georgetown - great food, great shops/ the ""exorcist"" steps are located there, too. the exorcist steps ",0.9885597825050354,0.005441705696284771,0.03414950892329216,0.003012964967638254,0.005041556898504496,0.002573060104623437,0.0013460430782288313
"Danish PM on the topic - ""We are not Socialist""",0.002330368384718895,0.0048799351789057255,0.002050194190815091,0.0016151675954461098,0.0007803678745403886,0.0010467491811141372,0.0021716603077948093
"I'm sorry but ""Amish heifer"" took me OUT. ",0.03609830141067505,0.0216393880546093,0.13263584673404694,0.01840057410299778,0.011125889606773853,0.017852574586868286,0.9968639612197876
I have been really close friends with her for over a year so I don't think that is the problem. I appreciate the comment though thank you.,0.41362059116363525,0.003809800138697028,0.99782794713974,0.008179135620594025,0.0033647138625383377,0.004314573481678963,0.0046503422781825066
ift yourself up on your feet! Let's get it on!,0.0019647167064249516,0.003959749359637499,0.0026368654798716307,0.0011978899128735065,0.0008252642001025379,0.002936887787654996,0.0015125350328162313
Guess I’m heading back to the kitche :),0.0014054859057068825,0.004436925519257784,0.004481648560613394,0.0012121691834181547,0.0008270390098914504,0.002493188949301839,0.003548546228557825
She’s out here lookin like Snuffleupagus from the muppets with those big eyes sheesh,0.29940181970596313,0.3058837652206421,0.000973894027993083,0.0013742874143645167,0.0011044014245271683,0.0010545628610998392,0.00022890049149282277
Absolutely amazing idea! 10/10!!!,0.9918268918991089,0.007755503989756107,0.04436270892620087,0.0032025701366364956,0.0059862034395337105,0.0030905616004019976,0.002513598883524537
" thanks bot! You too man!......Soooooo, what does YOUR hair look like?....",0.011014282703399658,0.011155910789966583,0.9976511597633362,0.006528895348310471,0.0016228287713602185,0.0037829731591045856,0.004853844176977873
"Yes, a lot of it ",0.02157801203429699,0.0014458299847319722,0.0017270375974476337,0.0019075768068432808,0.0018246850231662393,0.0010501211509108543,0.0015779209788888693
It's funny when a whole sub rejects any new information which doesn't fit their narrative.,0.007471862714737654,0.9917457699775696,0.004950409289449453,0.003915050532668829,0.0014328353572636843,0.0036940407007932663,0.00294122495688498
"Great video, and kudos for waiting them out and not letting your primal instincts let you attack from a wrong position!",0.9897924661636353,0.004736270289868116,0.057510994374752045,0.0027945665642619133,0.005540324375033379,0.0030527564231306314,0.0021974663250148296
I smelled this meme coming in from a mile off! So good :p,0.9504980444908142,0.03904402256011963,0.0030424874275922775,0.037875670939683914,0.0017822377849370241,0.002666991204023361,0.0007074056193232536
Would love a weapon selection thing for him where you can choose whether to have lightning or a saber for each hand,0.0777198076248169,0.0057017020881175995,0.004769940860569477,0.9913851022720337,0.00213324511423707,0.0030854588840156794,0.0013047297252342105
Definitely not overreacting. Leave.,0.0023610428906977177,0.001048273523338139,0.004431932233273983,0.0016761705046519637,0.0017940574325621128,0.00568566145375371,0.005377128254622221
"In both points and fouls Edit: [NAME], looks like he didn't pick up that foul. Good news!",0.9844750761985779,0.008008439093828201,0.046540725976228714,0.0015792632475495338,0.0036207186058163643,0.005669263191521168,0.0014800309436395764
"Also the infection that almost killed her because they tried to save the leg, leading her to get the prosthesis. ",0.002191222971305251,0.001652751350775361,0.004378946963697672,0.0012692780001088977,0.0009394545922987163,0.0016778470017015934,0.005842134356498718
Jeez i need to find some of these places around me..would love a $2 beer. Everywhere i go is like $9 for draft help,0.03162145987153053,0.04101286828517914,0.010479884222149849,0.9947311878204346,0.002568140160292387,0.006688258610665798,0.002307010116055608
Given [NAME] was in charge of the transition I don't see how he kept his hands clean. I think if [NAME] goes down so does he.,0.014432400465011597,0.0008314612205140293,0.0047462875954806805,0.001635944820009172,0.002126003848388791,0.0021517015993595123,0.0009380378760397434
It's still not something I'd jump to and I'm currently in a closed relationship really.,0.0020536526571959257,0.0013132115127518773,0.002614573109894991,0.002275889040902257,0.0016415431164205074,0.0034130741842091084,0.006213470362126827
"My bad on the terminology, see my response above for some of my thoughts / concerns related to the presence of 2-chlorophenol",0.0021186601370573044,0.003466258756816387,0.0162060409784317,0.004334196913987398,0.003070201724767685,0.005708461627364159,0.4672496020793915
leg-lock speaks to me in the most animalistic level,0.4178485870361328,0.011315258219838142,0.0018153449054807425,0.0016565045807510614,0.003823671955615282,0.001975041814148426,0.0005447431467473507
"Armenian elves are known for their thick skin and mouth-breathing. This one seems stoned, I’d stay away from it.",0.09077520668506622,0.002463829703629017,0.0023295716382563114,0.0009565431391820312,0.0013387007638812065,0.001301686163060367,0.0009521559113636613
Same company probably makes bacon for Walmart and Kroger. Im guessing they're not the only ones,0.005766861606389284,0.003271663561463356,0.002593414159491658,0.0008594483369961381,0.0006111175171099603,0.0011983538279309869,0.0009833795484155416
It's a great time to be Scottish anaw,0.9933151602745056,0.00655617518350482,0.030911581590771675,0.0047521586529910564,0.00688984664157033,0.003445453941822052,0.001805736101232469
He hasn't stopped clapping ever since,0.1471465528011322,0.0036446116864681244,0.0029992100317031145,0.0021792608313262463,0.010366718284785748,0.007224673870950937,0.0007556601776741445
this is amazing and you have the cutest voice i’ve ever heard :>,0.9945796728134155,0.010425232350826263,0.02063603140413761,0.010052169673144817,0.007209207396954298,0.002984834834933281,0.002314305631443858
"So, because its crypto business, they hold 1-2 weeks. Thanks for info ",0.008052551187574863,0.004519992042332888,0.9934536218643188,0.004513951949775219,0.0013434591237455606,0.0032588664907962084,0.004208877682685852
Congrats on the IP shadowban my dude,0.47367018461227417,0.16670067608356476,0.987993597984314,0.007409891579300165,0.014095955528318882,0.008434508927166462,0.0013248608447611332
"I, too, can use patronizing terms of endearment with a perfect stranger on the Internet, cupcake ;)",0.004051889758557081,0.0035503709223121405,0.003698295447975397,0.0026399032212793827,0.0007042338256724179,0.0011229673400521278,0.0007042908691801131
I had did the same thing sometime in December. I hope you'll be fine and I'm very proud of you for not harming yourself after,0.764693558216095,0.13208717107772827,0.34573906660079956,0.12209252268075943,0.9665592312812805,0.2309655100107193,0.13991156220436096
Cute! And similar coloring to mine. :),0.9913169145584106,0.0058825379237532616,0.0077424366027116776,0.0728248804807663,0.006705838721245527,0.0019000997999683022,0.0009714890620671213
"lol, this is so much me, I'm actually loling and not just typing it. :D",0.013066516257822514,0.9971887469291687,0.007867664098739624,0.006153359543532133,0.0032139765098690987,0.006382956635206938,0.004381943494081497
"“Listen, buddy!” “Listen, fella!”",0.0029681383166462183,0.004717818461358547,0.0020947731100022793,0.0012793592177331448,0.0006394280935637653,0.0014494163915514946,0.0017375238239765167
Lol it should be in the brig (not the brigantine) for those poor souls to play but it only plays becalmed.,0.007365975994616747,0.9936123490333557,0.00525424350053072,0.0035597290843725204,0.0019387328065931797,0.004058011341840029,0.003327152458950877
"WE WERE WINNING UNTIL I STARTED WATCHING, I AM CURSED!",0.7045570015907288,0.06259017437696457,0.08819039165973663,0.0033285170793533325,0.3972845673561096,0.10935388505458832,0.012610037811100483
if you hate pedos then check out,0.002850855467841029,0.0025282669812440872,0.0025572413578629494,0.0017947177402675152,0.0007509255665354431,0.0016237569507211447,0.0012385938316583633
Lol. Thanks for the info,0.023550154641270638,0.9644902944564819,0.9898063540458679,0.01626119762659073,0.006012700032442808,0.020574450492858887,0.013531282544136047
Zoos are the reason why many endangered species are no longer endangered. You oppose the existence of zoos. Therefore you would rather see those animals go extinct.,0.002874889178201556,0.0024434973020106554,0.0017971275374293327,0.0018929123179987073,0.000869711278937757,0.0010634150821715593,0.0016808937070891261
They are elected to represent Scotland,0.01693802699446678,0.0022513095755130053,0.010253875516355038,0.00687449611723423,0.0021997939329594374,0.0014684258494526148,0.0006619491032324731
It's rare to see a wholesome post here. Nice to see them nonetheless.,0.9899975657463074,0.004542125388979912,0.01615998148918152,0.007729706354439259,0.005024388432502747,0.003433448961004615,0.0015408642357215285
Everything in here I want but all we can do is pray to [NAME] for our wishes to come true,0.006391466595232487,0.0030204958748072386,0.5739977359771729,0.02938176319003105,0.0032323661725968122,0.01180477999150753,0.0011443911353126168
Thanks. I needed this reminder today.,0.008147531189024448,0.00790801364928484,0.9982705116271973,0.00973699614405632,0.0022298586554825306,0.00505549181252718,0.01717374660074711
Do you have arthritis yet? To me it seems my arm wouldve fallen off doing this.,0.0014727896777912974,0.009937155060470104,0.001954651903361082,0.0011406895937398076,0.0011085669975727797,0.003438347252085805,0.007248180918395519
Tech hobbyist scifi fan (me): That fridge is going to get hacked,0.005090946797281504,0.003734966041520238,0.0013361431192606688,0.002356627257540822,0.000640390848275274,0.000918499834369868,0.000649208901450038
Bore my children,0.0057867830619215965,0.007946372032165527,0.005739017389714718,0.6726675629615784,0.005702731665223837,0.004421154502779245,0.002190196420997381
