text,admiration,amusement,gratitude,love,pride,relief,remorse
"It was actually pretty great, definitely going to return next week! :)",0.9923517107963562,0.006221560761332512,0.10059861838817596,0.0028694127686321735,0.005954852793365717,0.004304257221519947,0.0023880680091679096
Being too scared of calling someone isn’t a disability for fuck sakes... use some common sense and grow up.,0.007496869657188654,0.0018760890234261751,0.0012728112051263452,0.0015701663214713335,0.0012989850947633386,0.0020644492469727993,0.0009226715192198753
"It looks like someone else was deleted for answering, so I'm hesitant to now. ",0.0022822492755949497,0.0018059553112834692,0.0058439262211322784,0.0012077182764187455,0.0011554401135072112,0.0025308355689048767,0.006424713879823685
Thank you so much. Fur babies are one of a kind.,0.030835028737783432,0.005715527106076479,0.9988240599632263,0.008019402623176575,0.0023083393462002277,0.006520262453705072,0.003738050814718008
Lovely experience on the trains this morning lool getting me practiced for being in a coffin,0.9137755036354065,0.8916144967079163,0.01739506796002388,0.48054516315460205,0.004707979038357735,0.007488923147320747,0.0020489594899117947
"oohh, that makes a lot more sense now, thank you kindly",0.026789817959070206,0.012389950454235077,0.9989147186279297,0.003804196370765567,0.00281996326521039,0.009447791613638401,0.004840335808694363
The one who accidently paid 1 cent less couldn't have just given the other dumb bitch a penny? smdh,0.0036653904244303703,0.017814841121435165,0.001396441482938826,0.0006086009670980275,0.0005528171313926578,0.001024845289066434,0.0010155820054933429
Hey it's really green here right now thanks to the last few rainy months!,0.024355337023735046,0.004531556274741888,0.9966452717781067,0.004824366420507431,0.001812826143577695,0.0062350984662771225,0.0016122706001624465
This is what happens when you don’t beat up the nerd enough,0.0030406888108700514,0.004080245736986399,0.0014393656747415662,0.0009862041333690286,0.0008313843281939626,0.001343687647022307,0.0017156156245619059
"“Our decaf is like really good tho gurl, you’ll be okay”",0.9512667655944824,0.007415084633976221,0.01986096426844597,0.0014073395868763328,0.006845070514827967,0.018831631168723106,0.0006011156365275383
"Man if you want some crazy dreams, slap on a few nicotine patches before bed.",0.0017320449696853757,0.004776425659656525,0.001703323912806809,0.0014495557406917214,0.0005967759643681347,0.0011293698335066438,0.002466256730258465
Haha. Dried fruit is partially how I got fat again.,0.01429001148790121,0.9955759048461914,0.005184798501431942,0.0037905550561845303,0.002595243975520134,0.005324173718690872,0.0034781843423843384
cultural norms is an interesting way of classifying the sort of people I see doing ~100% of littering in NYC.,0.6820306777954102,0.003699750639498234,0.005246062763035297,0.001305141719058156,0.001202298328280449,0.0013936808099970222,0.0009476655395701528
"Meh, the Chiefs got gifted a PI call or two, especially on their last drive to tie the game.",0.021843748167157173,0.0022203815169632435,0.00477001303806901,0.0006567651871591806,0.002384807448834181,0.003343680640682578,0.0007950038998387754
Great thanks for the advice!,0.5987247228622437,0.004384565632790327,0.997286319732666,0.00587875209748745,0.0029767134692519903,0.005343197844922543,0.003159169340506196
"The way his head snapped up, it looks like she caught him on the chin. That would also explain why he got knocked out.",0.006032190285623074,0.007788358721882105,0.0014674334088340402,0.0006553889252245426,0.0005442360998131335,0.0009865537285804749,0.001366342999972403
"So does [NAME], so much for him being a Thibs guy.",0.10811220854520798,0.0011157027911394835,0.0034091174602508545,0.003481269581243396,0.0033332156017422676,0.0011190333170816302,0.0005024332203902304
Vapenorth.ca is a great place to order the Dyna from.,0.9847971796989441,0.0054368688724935055,0.027406353503465652,0.002989953150972724,0.003305041231215,0.0026919867377728224,0.0013954144669696689
"So cool! So bonkers that people do this, I love it! Do you mind if I post these on my pages?",0.8094817996025085,0.01098568458110094,0.011097684502601624,0.9891194105148315,0.00787473563104868,0.009055846370756626,0.001342594507150352
That’s kind of the point of comment sections.,0.002611963078379631,0.010396651923656464,0.0017917806981131434,0.0008732365677133203,0.0005083861178718507,0.0010736044496297836,0.0017276223516091704
Thank you very much.,0.011958292685449123,0.007818462327122688,0.9983401298522949,0.006644221022725105,0.0020378045737743378,0.005425528157502413,0.007357961498200893
Old man yells at cloud,0.002734121633693576,0.021580353379249573,0.003253168659284711,0.0005714945727959275,0.0006751196342520416,0.0012583996867761016,0.0014355560997501016
"Thank you, that means a lot.",0.014235762879252434,0.008343934081494808,0.9989446997642517,0.008349486626684666,0.0023840046487748623,0.007387986872345209,0.007872742600739002
"""I have to deal with this, so now you have to also."" ",0.001752842916175723,0.0018115987768396735,0.007505578454583883,0.0015874744858592749,0.0021848829928785563,0.004675857722759247,0.034384701400995255
Making you sign a refusal of service waiver is scared of liability. Charging you for it is shady.,0.0023323979694396257,0.006270992569625378,0.0015602873172610998,0.0009476578561589122,0.0005422417889349163,0.0008764871745370328,0.0026422396767884493
Orange man = bad,0.002178320661187172,0.005900030955672264,0.00197221920825541,0.0012446832843124866,0.0007696624961681664,0.0014315764419734478,0.00264722784049809
And [NAME] is the opposite.,0.004825531505048275,0.0026725088246166706,0.0024663014337420464,0.0011623739264905453,0.0007909577689133584,0.0012747535947710276,0.001473798998631537
"Depends on the state, generally speaking.",0.003249326953664422,0.0017079495592042804,0.005152096971869469,0.0010560196824371815,0.0009699062793515623,0.0016355273546651006,0.0036796536296606064
I feel like this list is way off base from what we've been hearing.,0.002419770462438464,0.003377394052222371,0.002163657685741782,0.001117847510613501,0.0007430301629938185,0.0017676313873380423,0.005740013439208269
[NAME] Need people to play with so thanks :),0.014483079314231873,0.01631988398730755,0.998043417930603,0.006739972159266472,0.0018467297777533531,0.004574005492031574,0.0028912918642163277
Both. lol,0.009844059124588966,0.9962441921234131,0.008025504648685455,0.004765707068145275,0.0022769286297261715,0.004688936285674572,0.004380283877253532
Just heard the Xbox Rare Achievement sound go off in my head.,0.0035126882139593363,0.008808535523712635,0.0014970774063840508,0.0012597391614690423,0.0008175650145858526,0.0014650841476395726,0.00403182115405798
"Yeah, it'll be a pretty strong 3 team race among the Nats Braves & Phillies! It'll be fun to watch it from afar!",0.5097757577896118,0.9859485626220703,0.008696511387825012,0.006004902068525553,0.003635559929534793,0.006934397388249636,0.001027695252560079
One day please show this post to him it is so beautiful and kind.,0.993855893611908,0.005293547175824642,0.03200756758451462,0.03144415467977524,0.008042441681027412,0.0021811758633702993,0.0014112767530605197
r/btc is the only place in the world who thinks like that while the rest of the world thinks Bcash is a shitcoin nobody uses.,0.004091450944542885,0.0037809163331985474,0.0015825009904801846,0.0009268986759707332,0.0006917138816788793,0.001223853207193315,0.0010123125975951552
Cool. Glad I'm not the only one who found it weird.,0.32469889521598816,0.07457346469163895,0.7147074341773987,0.02762487903237343,0.1375238597393036,0.9603413939476013,0.04883820563554764
[NAME] as [NAME]: Be 1% Less Worse,0.004184544086456299,0.004047652706503868,0.001721643377095461,0.001126046059653163,0.000762013194616884,0.0012165230000391603,0.001136398990638554
"But little did I know, she found out about ""[NAME]"" texts",0.00301103456877172,0.003909464925527573,0.005042444448918104,0.0011776660103350878,0.0007504866225644946,0.0019985693506896496,0.003073950530961156
"Sorry, I don't get it. ELI5 please.",0.031333938241004944,0.02200978994369507,0.15667317807674408,0.016134226694703102,0.008704736828804016,0.013426990248262882,0.9962865114212036
Hahaha. Oh [NAME]. Way to ruin the fun lol,0.02500794269144535,0.9981482028961182,0.012778446078300476,0.006022848654538393,0.0036978882271796465,0.007341888267546892,0.005016975570470095
"Well, yes and no.",0.004410419147461653,0.0008919524843804538,0.0069147394970059395,0.0012836458627134562,0.0012008025078102946,0.002515156054869294,0.001733757322654128
They did and he is going to be extremely difficult to feel much empathy for him.,0.0758022740483284,0.0007040674099698663,0.01617460511624813,0.01434273924678564,0.03026307187974453,0.012965564616024494,0.03008154220879078
"omg this is so cute, thank you u/Skraxx",0.8183009624481201,0.022266635671257973,0.9978083968162537,0.05462757498025894,0.006330868694931269,0.006837120279669762,0.0024628243409097195
I love my Arabian but I have found the golden turkmen to be my more go to horse.,0.07144235074520111,0.007259550038725138,0.012975002638995647,0.9971314668655396,0.008404719643294811,0.008732327260077,0.0045305234380066395
"Never argue with stupid people, they will drag you down to their level and then beat you with experience.' - [NAME]",0.013453970663249493,0.013428431935608387,0.0007682259893044829,0.001664709416218102,0.0010852902196347713,0.0008437003707513213,0.0005307194078341126
At least you should have helped out since you had rudely interrupted him.,0.011671224609017372,0.005023184698075056,0.044309671968221664,0.0004249976191204041,0.00466801505535841,0.03877607733011246,0.05572659894824028
"No passes on skin color or class, yeah right thats why [NAME] is a supreme court justice right ??? ",0.005011903587728739,0.0030859315302222967,0.00142518465872854,0.0010835474822670221,0.0010168638546019793,0.0017024477710947394,0.0006921144668012857
Make sure to tell her /r/Austin helped you pick a place! She'll appreciate the thought you put into choosing a place special to her.,0.9791226387023926,0.002943646628409624,0.24189971387386322,0.0038988038431853056,0.0038374036084860563,0.0025675760116428137,0.001631985534913838
"Friends for eternity! Loyalty, honesty!",0.9210398197174072,0.0015378132229670882,0.08203121274709702,0.020196598023176193,0.14792613685131073,0.005767539609223604,0.002134016714990139
"Wow, my favorite artist and my favorite basketball player. This video is next level 🌊",0.9674220085144043,0.015390157699584961,0.006440137512981892,0.7627975940704346,0.008602069690823555,0.0022380584850907326,0.001022698008455336
"He's gonna say ""stop eating chips""",0.0025058386381715536,0.034633200615644455,0.001335797132924199,0.0012462141457945108,0.00045625935308635235,0.0010158481309190392,0.0009323614649474621
"Check out [NAME], he's like the [NAME] of dissosiatives. ",0.01734706200659275,0.0025219039525836706,0.0008726718369871378,0.0032431308645755053,0.0006259089568629861,0.0008507370948791504,0.00033387821167707443
[NAME] are proof of this.,0.013417923822999,0.003016520757228136,0.0070318072102963924,0.0003618098853621632,0.001192688476294279,0.002123388461768627,0.0020716299768537283
"Unfortunate for him, but I'm bringing up players. >AND they can just stop being a support.",0.001733735902234912,0.0022798466961830854,0.0035694725811481476,0.001529735280200839,0.0014425135450437665,0.003126236144453287,0.028332721441984177
There is so much positive support and affirmation in this thread and I love it. Congratulations OP.,0.6288338303565979,0.010270153172314167,0.9482346177101135,0.9520448446273804,0.07184620946645737,0.015371561981737614,0.004383776802569628
"Sorry, I meant C",0.039644356817007065,0.029883747920393944,0.11226900666952133,0.017036164179444313,0.010283781215548515,0.01370183750987053,0.9969032406806946
"Do you have a link? I never saw the video, I only heard about it",0.0018484699539840221,0.005966250319033861,0.001595830894075334,0.002299357671290636,0.0009292003232985735,0.0012601346243172884,0.004868671763688326
seriously... if he was going to play in LA he wouldn't do it with a 2 hour commute lol. he would just buy a mansion in LA,0.00806773267686367,0.9923933744430542,0.004968889057636261,0.002855377271771431,0.0017194475512951612,0.0038150972686707973,0.0028893693815916777
I suspect there's a difference between people who have an interest in makeup and those that don't on this.,0.0023591790813952684,0.0030535287223756313,0.0020759827457368374,0.0012893103994429111,0.0006723294500261545,0.0016342151211574674,0.0048766671679914
"I wake up as a girl everyday. A girl with a penis, huge hands, hair like fucking everywhere, no tiddy, and an unwelcome boner.",0.008696342818439007,0.05676791071891785,0.0005968564655631781,0.0099872425198555,0.0013288947520777583,0.0021476675756275654,0.0013929343549534678
Never thought about it but it’s bloody obvious when pointed out! Good tip,0.9866591691970825,0.004735647235065699,0.05918679013848305,0.0018888437189161777,0.006694657728075981,0.005696676205843687,0.0017521122936159372
Actually looks really fucking fun. Where can I do this?,0.17664293944835663,0.9977992177009583,0.015335021540522575,0.008208482526242733,0.006692260969430208,0.013980225659906864,0.006820080801844597
What an incel,0.5214691162109375,0.004930640570819378,0.0019103079102933407,0.0010549175785854459,0.0015217396430671215,0.0008166377083398402,0.0011642067693173885
Good luck with it all. I hope she recovers. Keep me updated if you remember haha,0.08502500504255295,0.9814366698265076,0.7393614649772644,0.004206398036330938,0.004816691856831312,0.06094643101096153,0.003196725621819496
Going to bed early never works for me. Sleeping in is the only way I feel rested.,0.006564389448612928,0.0015323500847443938,0.00380996847525239,0.004963730927556753,0.004448297433555126,0.02673112042248249,0.0034700175747275352
The Pants by [NAME]. Give it a listen. Lol,0.012237141840159893,0.9941907525062561,0.005234802607446909,0.003401286667212844,0.0019288063049316406,0.004059595987200737,0.0022769428323954344
There is this story of a woman who got pregnant from anal due to some rare condition:,0.00500252190977335,0.019374290481209755,0.002763742348179221,0.003068290650844574,0.0006135801086202264,0.0008827762212604284,0.0017130001215264201
He didn't blow anything. She blew it with him. What a fun guy!,0.6175963878631592,0.9753893613815308,0.00445659551769495,0.004735247232019901,0.005042135715484619,0.007939176633954048,0.001278298906981945
Mind if I use your allegory in my classes? It's perfect.,0.9758520722389221,0.001944030518643558,0.015893885865807533,0.0032754226122051477,0.009073033928871155,0.004304755944758654,0.0011247772490605712
I'm guessing [NAME] and [NAME]. [NAME] needs to remove that stick up her ass.,0.0019336342811584473,0.005226785782724619,0.0015327344881370664,0.0009831336792558432,0.0007468961412087083,0.0014577382244169712,0.002148380735889077
[NAME]. I still want her to come back to be a [NAME] ally and fight with [NAME].,0.007996061816811562,0.0017605945467948914,0.0011743272189050913,0.006195614114403725,0.0016099006170406938,0.0012165786465629935,0.0004644292639568448
37 and together 12 years. 11 yo kiddo. Thanks for the tip. You're right.,0.021978260949254036,0.005898948758840561,0.9967491626739502,0.0029097353108227253,0.0015280531952157617,0.004020157735794783,0.002621540566906333
"Thank you, agreed. ",0.010565447621047497,0.007338264491409063,0.9984948635101318,0.006401867605745792,0.00212988187558949,0.007259196136146784,0.007473595906049013
"Oh it is, it's just that you know that thing...about the intel",0.005836609285324812,0.003137997817248106,0.0012206068495288491,0.001417791936546564,0.0007395416032522917,0.0008870367310009897,0.0008739012409932911
He's just showing off for the camera there.,0.0029511197935789824,0.003074405249208212,0.0021474885288625956,0.0009022394078783691,0.0006006949115544558,0.0011189741780981421,0.002193653490394354
"The grey shirt guy: ""Oh shoot! I leave the stove on!""",0.0022833331022411585,0.008705527521669865,0.0018859223928302526,0.0014885197160765529,0.0009338928502984345,0.0016720733838155866,0.001127170748077333
"[NAME], I love hearing them click in the water. The sound of a healthy ecosystem.",0.24242575466632843,0.00620253523811698,0.005855998490005732,0.9950602650642395,0.00285904249176383,0.003862782148644328,0.0015575591241940856
You legitimately sound like a hipster.,0.11966048926115036,0.0065298667177557945,0.0013699111295863986,0.0004441434284672141,0.0010496200993657112,0.0009441844304092228,0.0007294640527106822
Thats what happens when [NAME] is on the fucking floor,0.0028999089263379574,0.006175195798277855,0.0012349877506494522,0.0011059943353757262,0.0006650089053437114,0.0009922977769747376,0.001467507565394044
[NAME] is a nut; he has a rubber butt!,0.32291895151138306,0.016445646062493324,0.001062595285475254,0.0008647284703329206,0.001301298849284649,0.0008336095488630235,0.00022272173373494297
Educate yourself instead of defining yourself.,0.0035030741710215807,0.0028447569347918034,0.0023000938817858696,0.0016991072334349155,0.0010530479485169053,0.0013830751413479447,0.001558602089062333
"Very insightful and tragic post, OP. Thank you for sharing and raising awareness as someone who has been through the trenches.",0.10667984187602997,0.0029500031378120184,0.9982064962387085,0.003567868610844016,0.003035599132999778,0.006334889214485884,0.0031128369737416506
"I love how they all state the stupidity in the quote and the person saying it, with only a few realizing it's something [NAME] said.",0.06817139685153961,0.009967016987502575,0.006605423055589199,0.996051013469696,0.0040414161048829556,0.005128911696374416,0.0025059364270418882
Not related to any of this but I love your tag next to your username xD,0.0992489606142044,0.006725511513650417,0.006798577960580587,0.9954571723937988,0.003099926747381687,0.004811485297977924,0.0023100741673260927
You still haven't shown any evidence of racism outside your own mind.,0.0031584694515913725,0.0020078876987099648,0.0015884784515947104,0.0014470297610387206,0.0014014135813340545,0.0019928994588553905,0.0027272303123027086
You mean pan de huevo Check food city,0.0026735502760857344,0.005310975480824709,0.0023240402806550264,0.001556049333885312,0.0005350859719328582,0.0010005029616877437,0.0011575602693483233
Thanks [NAME]!,0.017857491970062256,0.009375830180943012,0.998390793800354,0.007332921028137207,0.002054364187642932,0.0042847623117268085,0.005281606689095497
"Yeah, great!",0.9908010363578796,0.009001526981592178,0.0528135672211647,0.0024781464599072933,0.005534718744456768,0.0037237987853586674,0.002904650289565325
[NAME] stop thinking too much and just do stuff like that,0.002373417606577277,0.05536826327443123,0.0010766376508399844,0.002238320419564843,0.0005544281448237598,0.0014790066052228212,0.0008366425754502416
This is a great photoshop! On a related note... retire [NAME] Number and Maybe [NAME] number..... oh and also fire Garpax,0.9806039929389954,0.005838250275701284,0.026764634996652603,0.0018270898144692183,0.002579375170171261,0.002996360883116722,0.0009479739237576723
They're basically our version of [NAME] and [NAME] at this point. Every video seems to involve a dumbass rant that misses the point of the topic.,0.003696588333696127,0.017081474885344505,0.001410488155670464,0.0005843148683197796,0.0004956828779540956,0.00099141092505306,0.001837416086345911
I’ve actually been there lol,0.01083595585078001,0.9973288774490356,0.009763436391949654,0.006530216429382563,0.002825674368068576,0.006366408430039883,0.004849713295698166
You're way too involved in this. Take a break from the internet.,0.0019491498824208975,0.003329506143927574,0.0020272666588425636,0.0008513026987202466,0.0008272490231320262,0.002235025865957141,0.008656268939375877
Nor am I as his servant. Though seeing him happy is awesome!,0.9932616353034973,0.01054559275507927,0.024567104876041412,0.0027552249375730753,0.010469313710927963,0.004214221145957708,0.002444419078528881
"Going through a divorce right now. Her saying ""I love you and maybe we should go to counseling"" would make me more than happy.",0.03594416007399559,0.006499679759144783,0.006639470811933279,0.9920390844345093,0.0024526966735720634,0.003691360354423523,0.002428060630336404
"I haven't killed one yet, but I did kill someone that had a carcass. I think I got $3 at the butcher.",0.005374383181333542,0.00220590946264565,0.004786722827702761,0.002744399243965745,0.00850204098969698,0.004363976884633303,0.004337204620242119
ALL ABOARD THE HYPE TRAIN!,0.011505615897476673,0.001896715140901506,0.002786606317386031,0.0012741435784846544,0.0011842602398246527,0.0016824754420667887,0.0005856465431861579
Margin of error: 0.7%,0.008794296532869339,0.0028847858775407076,0.027916675433516502,0.0007852292619645596,0.0015372114721685648,0.004815119318664074,0.032107025384902954
If they overdo it and burn themself out it may be.,0.0020908028818666935,0.0037042968906462193,0.001873772474937141,0.001457015983760357,0.0006898153224028647,0.0012139283353462815,0.0021347752772271633
"As far as I know, the last necromancer you kill is guaranteed to drop a lantern.",0.00415025046095252,0.0024078350979834795,0.0027851795312017202,0.0010298623237758875,0.0010173938935622573,0.00221625785343349,0.0019624410197138786
"She might die before then, risky move either way.",0.002558609936386347,0.0035179697442799807,0.003061329247429967,0.0008111479692161083,0.0007280430872924626,0.001626957906410098,0.006883572321385145
Epiploic Appendagitis. Although it’s almost certain that you’ll have to affirm that you aren’t talking about appendicitis.,0.002191399224102497,0.0018299277871847153,0.00267698778770864,0.001248251530341804,0.0008994528907351196,0.0017291773110628128,0.0031054106075316668
I'm beginning to think that ArcSys might be my favorite videogame company. They make such good fighting games.,0.9883745908737183,0.0052614109590649605,0.011040596291422844,0.06349826604127884,0.005345400422811508,0.0014564644079655409,0.0008240803726948798
so she's not only stealing kids but fingering her cousin as well? She's pretty wild,0.7350752949714661,0.005654334556311369,0.0014910720055922866,0.0017431031446903944,0.0013125737896189094,0.0010321346344426274,0.0004854100407101214
Kk cause I love touching up my tops so I'm just making sure 😂 &#x200B;,0.04661338031291962,0.014749012887477875,0.01059562899172306,0.9968619346618652,0.004701577592641115,0.00716423662379384,0.003438549814745784
"If we'd reintroduce wolves to bathrooms, coyotes wouldn't be a problem.",0.006344775203615427,0.0015724764671176672,0.004456897731870413,0.0014026284916326404,0.001583494246006012,0.010142344050109386,0.0018385647563263774
"Go forth brother and make her so. If you build it, they will come. ",0.0032402495853602886,0.0021458889823406935,0.0017555910162627697,0.0029586285818368196,0.0008773687877692282,0.0011211332166567445,0.0007450783159583807
Everyone has their own preferences I happen to play better when I have multiple balls in my pockets.... no pun intended,0.0119429100304842,0.0018617893802002072,0.002862804802134633,0.0020660569425672293,0.0041888863779604435,0.007623821496963501,0.0008134312811307609
My favorite new fan! Glad to see you here! Rest up and get ready for the Friday game.,0.9341727495193481,0.0027869190089404583,0.6579229235649109,0.8361228108406067,0.011592607013881207,0.012004776857793331,0.0010261167772114277
I am a ethnic [NAME] and demand that normies get out! REEEEEE,0.00176023761741817,0.011301781050860882,0.0011775795137509704,0.0036845500580966473,0.0016427203081548214,0.0012117375154048204,0.0017463022377341986
Not adjacent. Far enough away that I am not easily in sight but could get to the hook 2-3 seconds after I see that glint of movement.,0.046096399426460266,0.0016219861572608352,0.002200878458097577,0.0008982491563074291,0.0019840062595903873,0.0020382923539727926,0.001246917643584311
I love how far some people stretch. I don’t think this fits the sub and now I’m a [NAME] that uses storefront. Nice.,0.590006947517395,0.003945217467844486,0.0031439552549272776,0.9815109372138977,0.0031539599876850843,0.003298283088952303,0.0010361972963437438
>New Years Penis,0.004660813603550196,0.002871133852750063,0.0014764195075258613,0.0049083954654634,0.0008406245615333319,0.0009904555045068264,0.0006180933560244739
Seriously. I legit laughed at this.,0.014812799170613289,0.9969781637191772,0.010403246618807316,0.004798686131834984,0.003091600490733981,0.005406202748417854,0.007887042127549648
"[NAME], I love the Expanse so much. Next to Mindhunter, Daredevil, and Breaking Bad, I've never enjoyed a series like those 4.",0.21230632066726685,0.00673986691981554,0.007529454305768013,0.9967650175094604,0.0051714093424379826,0.005409864708781242,0.0026761351618915796
"[NAME] has strong ties with one person. [NAME] has strong ties with 3, maybe 4. ",0.010219897143542767,0.0008552232175134122,0.002318789018318057,0.00443003885447979,0.0014921600231900811,0.0011001748498529196,0.0009161644848063588
">!the only time it's become a harem is in the epilogue, and it's only 1 part of him!<",0.004537546541541815,0.0024521215818822384,0.002664295956492424,0.002842123154550791,0.001150786061771214,0.0021454980596899986,0.0006904388428665698
Great mate good luck!,0.9786010384559631,0.0031973926816135645,0.5805385112762451,0.0031239944510161877,0.0030082545708864927,0.0037056785076856613,0.0017867906717583537
Yes!! There are some great step parents on the show!!,0.9899090528488159,0.004643602296710014,0.041838470846414566,0.00435639638453722,0.007285904139280319,0.0027500218711793423,0.0011019501835107803
