text,admiration,amusement,gratitude,love,pride,relief,remorse
I'm so sorry. I hope things get better. 💗 I know emotional damage is rough.,0.049957334995269775,0.03037954494357109,0.08375122398138046,0.03436301648616791,0.016404716297984123,0.021390652284026146,0.9972820281982422
That’s exactly how my non-union electrical company works ... it’s the funniest unfunny joke,0.029732171446084976,0.9973263740539551,0.00928142573684454,0.005316886119544506,0.003263956867158413,0.005471816752105951,0.004332480952143669
"i love these wholesome stories when they appear in this sub. nice one, OP!",0.9319390654563904,0.008075310848653316,0.016461364924907684,0.9769922494888306,0.005215207580476999,0.004764743614941835,0.0014426893321797252
"As a lover of PG and Scrubs, I've not seen this one. What a genius tongue in cheek celebration to [NAME], [NAME] and PG.",0.8365501761436462,0.004368131048977375,0.0019344690954312682,0.011685413308441639,0.003549809567630291,0.0008251973777078092,0.0004052402509842068
[NAME] is definitely out of frame lol,0.008255084045231342,0.9931206107139587,0.005772321484982967,0.0025946726091206074,0.0018230867572128773,0.003965478390455246,0.0033959762658923864
Growth cannot persist forever in a finite system.,0.002695821225643158,0.0020767496898770332,0.002489102305844426,0.0010552110616117716,0.0008711153641343117,0.0014983916189521551,0.004027195740491152
It looks a little like the nubbin you see on some amputated arms. Right?,0.019578123465180397,0.017634134739637375,0.0008447989239357412,0.0015572328120470047,0.0006119649042375386,0.0009489227668382227,0.00041669802158139646
That’s good but why would you waste your time on a crappy team?,0.9423198103904724,0.0036466417368501425,0.022722696885466576,0.0008907917654141784,0.0034271276090294123,0.007720455061644316,0.0013851303374394774
I just call my girl and tell her I love her lol. Easy day.,0.021272117272019386,0.9873601794242859,0.01718226447701454,0.8330205082893372,0.004493262153118849,0.008911526761949062,0.0042806388810276985
"Even in Star Trek they have $, they just dont really talk about it. The point is basic needs are so trivial",0.0020011798478662968,0.007944316603243351,0.002716842805966735,0.0005816973280161619,0.0008780729258432984,0.0023591534700244665,0.0030535301193594933
Oh this one is making the rounds again? The new cohort of [NAME] must have arrived,0.006374113727360964,0.0024513565003871918,0.003172723576426506,0.0007038798648864031,0.0013668681494891644,0.003848604392260313,0.0013575662160292268
Im coo coo coco crazy for you my chi chi cay cay cyborg aw aw arm!,0.013097112998366356,0.044685784727334976,0.0038091850001364946,0.2570450007915497,0.0009730754536576569,0.001380724716000259,0.00015761995746288449
I'm really sorry you're experiencing this. You are not in the wrong. I hope you can get away from their control when possible....stay strong,0.05315264314413071,0.01661679334938526,0.10985918343067169,0.018094608560204506,0.011422457173466682,0.019211918115615845,0.9960755705833435
Serious question. Can I be you,0.001611789339222014,0.004464692436158657,0.002775878179818392,0.001321221119724214,0.0006556184962391853,0.0013400816824287176,0.007614761125296354
Oh Lord...,0.0023029856383800507,0.008426915854215622,0.0023250961676239967,0.0035279649309813976,0.0013884147629141808,0.0033719236962497234,0.0012816607486456633
"Yeah, fuck you for enjoying music! I'd love to see your collection. ",0.3456420600414276,0.023064039647579193,0.007853236049413681,0.9969655871391296,0.003610027488321066,0.006035690661519766,0.0020489536691457033
I like where you’re going with this....,0.49353277683258057,0.004927307832986116,0.0034043786581605673,0.979686439037323,0.0024852773640304804,0.002434866037219763,0.0012204337399452925
"I just call em like I see em, [NAME]",0.005216197110712528,0.0222171563655138,0.0007991985185071826,0.07117115706205368,0.0009280815138481557,0.0008330191485583782,0.0003752868506126106
She’s his problem now.,0.003443728433921933,0.0016892849234864116,0.0025933280121535063,0.0008140517165884376,0.0009042498422786593,0.001704057096503675,0.0028277309611439705
he looks pretty average to me. like many guys i've seen on the train.,0.9861728549003601,0.005184061359614134,0.008790402673184872,0.00699653010815382,0.006344357505440712,0.0025278376415371895,0.0014576473040506244
"Dunno mate, Italy lookin strong ",0.7872958183288574,0.0007637907401658595,0.01448198314756155,0.0022105311509221792,0.00791129469871521,0.0023293730337172747,0.000775644148234278
Youre not a prude. Trash does what trash does.,0.0022731642238795757,0.005784122738987207,0.0015818660613149405,0.000858783139847219,0.0010409242240712047,0.0012691806768998504,0.002875453559681773
Which one? I like their podcast but I can totally see why a lot of people wouldn’t hahaha,0.16414277255535126,0.9930134415626526,0.005018025171011686,0.20421837270259857,0.003106646239757538,0.005230515729635954,0.0016682784771546721
Except for the part where [NAME] Millennial daughter is one of the big new heroes introduced in MKX...,0.05215812101960182,0.0009931386448442936,0.0030403491109609604,0.0013833696721121669,0.0035512722097337246,0.002340666949748993,0.0008186291670426726
I think this is one of my favorite Aquaria looks ever!!!,0.9765507578849792,0.007286545820534229,0.011180914007127285,0.4397774636745453,0.00778380548581481,0.001722540007904172,0.0008624158217571676
The nails are great,0.990892767906189,0.006314604077488184,0.032013341784477234,0.003993459511548281,0.006755670998245478,0.0028504380024969578,0.002431622939184308
I'll never forget how great [NAME] was that day.,0.9853083491325378,0.008270831778645515,0.042522795498371124,0.0018584622303023934,0.006361029576510191,0.003068490419536829,0.002132926369085908
You could buy a used car for the price of those shoes!,0.004727058578282595,0.00825798511505127,0.0013385937782004476,0.001138791092671454,0.0004988282453268766,0.0008850371232256293,0.0006839457782916725
Thanks appreciate it,0.5014128684997559,0.004230127204209566,0.9971561431884766,0.005936832632869482,0.0037945874501019716,0.004316761624068022,0.003973407670855522
Put down that you are a starting forward and love incinerating $100 bills. Stay strong my Asia brah,0.093086376786232,0.002311481162905693,0.0031984385568648577,0.9727752804756165,0.005681934300810099,0.003663141280412674,0.0008940438274294138
Peel the avocado...,0.002900412306189537,0.0031348492484539747,0.0017688594525679946,0.002868948969990015,0.0007531580049544573,0.0012140267062932253,0.0009921606397256255
Hey there [NAME] what's it like in new york city,0.008598783984780312,0.007147359196096659,0.0008957739919424057,0.0019432792905718088,0.000459508242784068,0.0007082437514327466,0.0005605955957435071
"Yeah, that was in Episode 1 i think when she came to free him after he got captured by [NAME]",0.0032564247958362103,0.003627776401117444,0.0025684223510324955,0.0012152021517977118,0.0009225215762853622,0.0018685439135879278,0.001154133235104382
I'm not sure they know the difference between a mandate and legally binding.,0.002273830585181713,0.002937945071607828,0.0020401962101459503,0.001006587059237063,0.0007431464036926627,0.0014770228881388903,0.0029520331881940365
"As a rep 6 orochi, those dodge attacks from neutral made me cringe.",0.01632103882730007,0.1131814494729042,0.0025210464373230934,0.0012351784389466047,0.0038033630698919296,0.006805494427680969,0.003982875496149063
"same- just about to recommend this book. it's a fantastic review of rheum disease states, diagnoses, treatments, etc.",0.9768542647361755,0.006700847297906876,0.026316391304135323,0.0024471296928822994,0.0021417292300611734,0.0027076490223407745,0.0011260020546615124
Buncha people having (admittedly loud) fun. Don’t really see the issue.,0.0042304084636271,0.8975542187690735,0.0017601118888705969,0.001614687847904861,0.000892115174792707,0.0023545778822153807,0.0016410922398790717
If push comes to shove the easy alternative is you show up for work and take up space but don't actually perform your job.,0.0015805027214810252,0.0029487956780940294,0.0025456438306719065,0.0011314620496705174,0.0008844651165418327,0.002027763519436121,0.00389356492087245
"If it results in killing [NAME], [NAME] is willing to be merciful and hold his wrath back against the kids.",0.004636198282241821,0.0033031003549695015,0.001856589806266129,0.0008452829206362367,0.0007718516862951219,0.0013026077067479491,0.0013599011581391096
LETS GO MO,0.0013542171800509095,0.01469308789819479,0.0025309440679848194,0.0016080919886007905,0.0008648340008221567,0.0018242317019030452,0.0016789879882708192
It was a stroller so no real harm done. Thanks for asking x,0.008263188414275646,0.007292918860912323,0.9974036812782288,0.004841642454266548,0.0015794638311490417,0.006097128614783287,0.0054791937582194805
I love the small hole in the clouds with the moon (sun?) peeking through,0.07899130135774612,0.01057879626750946,0.008805005811154842,0.9967520236968994,0.003329159691929817,0.005586003419011831,0.0029029245488345623
"Seriously one of the best soundtracks. I always get chills from the organs, even just thinking about them.",0.9891748428344727,0.006628978066146374,0.01154146995395422,0.006964586675167084,0.005453574005514383,0.002916027093306184,0.0018001110292971134
> Take away the snow and it looks like an IU home game. Damn [NAME].,0.07715661823749542,0.025842655450105667,0.0007390103419311345,0.001048946869559586,0.0009219201747328043,0.0008226453792303801,0.0003562714555300772
Roasted Brussels sprouts with they get kinda charred!! Nom nom nom,0.003937821369618177,0.008527671918272972,0.0011273522395640612,0.001622754498384893,0.0006222625379450619,0.0011300105834379792,0.000588804017752409
Why does everyone hate the creme brûlées? They’re easily my favorite.,0.4882008135318756,0.001493155024945736,0.0038007169496268034,0.854315459728241,0.0021029296331107616,0.001166401314549148,0.0006118917372077703
Very wholesome!,0.9241119623184204,0.0009188083931803703,0.04560786858201027,0.002288687275722623,0.007760458160191774,0.00432704808190465,0.0010181614197790623
"I mean, sharing is caring and momma wants her cummies. ",0.023363517597317696,0.0006476642447523773,0.003908226266503334,0.028330504894256592,0.002929828129708767,0.003102337010204792,0.0007142148679122329
"With Firing Range and Seaside having 2 variations, and everyone voting to replay them every time...It already feels like this",0.002544559072703123,0.006462733261287212,0.0012653484009206295,0.00258276448585093,0.0009225651156157255,0.0019223501440137625,0.0010515511967241764
Why I left the industry... it’s full of hipsters who don’t realize they’re hipsters. That was worse than the slave labor.,0.0021978344302624464,0.004833887796849012,0.0018741488456726074,0.0008484554127790034,0.0008135817479342222,0.0014120376436039805,0.008642314933240414
That’s why it’s a repost. To anyone who’s cake day is 2 day🤗,0.004683745093643665,0.02344837784767151,0.0013543410459533334,0.0025090838316828012,0.0007239997503347695,0.0010246719466522336,0.0006570478435605764
I’ve never seen the reverse tbh. All the brown guys I know get absolutely no hoes and just orbit women for life.,0.005260692443698645,0.0026858500204980373,0.0012940580490976572,0.002616087906062603,0.0013340584700927138,0.0020498058293014765,0.000820995366666466
How awesome ! Of course now the baby has THREE sets of grandparents. Extra bonus presents !,0.9931477904319763,0.006952029652893543,0.05733591690659523,0.0031912086997181177,0.007005470339208841,0.0033257706090807915,0.001590293599292636
"That’s awesome, what do you do if you don’t mind me asking?",0.9928212761878967,0.009627572260797024,0.02109362743794918,0.003245866158977151,0.00791774969547987,0.004210532642900944,0.0023668669164180756
Imagine thinking the government only pursues one file at a time.,0.0028764777816832066,0.005025089252740145,0.0021176976151764393,0.0012069621589034796,0.0005894997739233077,0.001047592144459486,0.0021997687872499228
no you should try again,0.0022053082939237356,0.002531801350414753,0.002121702767908573,0.0015188624383881688,0.0009289688314311206,0.0015975313726812601,0.0038272079546004534
Thoroughly entertaining.,0.9145416617393494,0.906224250793457,0.015483188442885876,0.0033905310556292534,0.004967359360307455,0.006948541384190321,0.0019050600240007043
The biggest problem is measuring IQ in some universal way. The tests all have built in biases about what the author considered intelligence.,0.004596053622663021,0.005154889076948166,0.0035006911493837833,0.0005932525382377207,0.0007450471166521311,0.001245735795237124,0.005166694056242704
Don't be fatuous [NAME],0.0027234735898673534,0.0017735720612108707,0.002166580408811569,0.0025748671032488346,0.0014710333198308945,0.0030515375547111034,0.0012649886775761843
You should find that for us. Also normally higher profile guys like [NAME] don't actually participate in the senior bowl,0.003068957244977355,0.002014613477513194,0.002343058818951249,0.0017073983326554298,0.0009757663938216865,0.0021315617486834526,0.0020808607805520296
Not to mention that the automation is meaningless if the economy that supports it has collapsed due to rampant poverty and unemployment.,0.002682225313037634,0.0020782204810529947,0.0023229846265167,0.0010371953248977661,0.0007795176352374256,0.0016952278092503548,0.002008307259529829
I personally took this of his snapchat.... [lmfao,0.002623698441311717,0.02444165013730526,0.011486569419503212,0.007651415187865496,0.01587202586233616,0.00827937014400959,0.012311218306422234
Nice Sir !,0.9901136159896851,0.0037353564985096455,0.13426873087882996,0.0038895129691809416,0.005230716895312071,0.0034709989558905363,0.0020761003252118826
"Who created, carried and raised all these men? A woman .",0.08973176032304764,0.0010907447431236506,0.002213984727859497,0.00151728093624115,0.00332869915291667,0.001015580608509481,0.0006628016126342118
So if it was a 14yo girl and she wanted it it’s ok?,0.0025759951677173376,0.0033248746767640114,0.0013659104006364942,0.0037945855874568224,0.0007033461006358266,0.0010965995024889708,0.000802829978056252
Thank you very much.,0.011958292685449123,0.007818462327122688,0.9983401298522949,0.006644221022725105,0.0020378045737743378,0.005425528157502413,0.007357961498200893
They have disagreed with a bunch of individual calls but not tied it together,0.0029432072769850492,0.0018993655685335398,0.0021139977034181356,0.001368560129776597,0.0011884663254022598,0.0014384326059371233,0.002704296726733446
Isn’t that the same as idols? I thought it’s a big nono for any intercession when it comes to [NAME]. I could be wrong though,0.002279406413435936,0.0158599354326725,0.0016753394156694412,0.0007105866679921746,0.000603207852691412,0.0011609188513830304,0.006892911158502102
Why not both,0.003021101700142026,0.0018258353229612112,0.003038193332031369,0.001461086911149323,0.0009407601319253445,0.001717642997391522,0.0019154432229697704
Thanks! I'll look into that,0.011522293090820312,0.010657768696546555,0.9973393082618713,0.006753831636160612,0.0017392681911587715,0.0038512125611305237,0.008257782086730003
That’s very admirable and courageous of her. I appreciate the many women that are doing that here on Reddit as well.,0.9914594888687134,0.0048721847124397755,0.16688954830169678,0.00633282121270895,0.04999943822622299,0.005187320522964001,0.005403285846114159
"Welp, can't see [NAME] beating [NAME] if she's in this form!",0.005301147699356079,0.003424133872613311,0.001492465496994555,0.0009220128413289785,0.0008289096876978874,0.0012819989351555705,0.0009180234628729522
Tag a friend who wakes up sexually horny,0.002178774680942297,0.004284705501049757,0.001900921924971044,0.00250614364631474,0.0006433252710849047,0.0010762002784758806,0.0028412716928869486
Imagine the wild sex?,0.0038655311800539494,0.005162335932254791,0.0016426061047241092,0.001678031636402011,0.0004951211740262806,0.0009267909917980433,0.0011285357177257538
Lmfao is that bexey wtffffff ahahhahahaha,0.014165079221129417,0.9961379170417786,0.005794521886855364,0.005552156828343868,0.0024545767810195684,0.005639929324388504,0.0029669248033314943
They say this picture is magic. You see whatever your heart most desires.,0.04048417881131172,0.00966932624578476,0.0012444444000720978,0.0016618581721559167,0.0006753960042260587,0.0006037623388692737,0.0003093111445195973
The StackExchange network might have turned into an elitist playground but it's damn good for finding a fix for your problems.,0.9305992722511292,0.00286572752520442,0.02213936112821102,0.0008287074160762131,0.002961621852591634,0.004118009470403194,0.0010897077154368162
Likely frostbite advisory weather.,0.0023164472077041864,0.003156543942168355,0.005456168670207262,0.0011384142562747002,0.0006444173050113022,0.001938190427608788,0.006977618671953678
her section at the tate museum is amazing,0.9897655248641968,0.00941263884305954,0.023815713822841644,0.0030493380036205053,0.006457081064581871,0.0029897144995629787,0.0024618275929242373
The Leafs weren’t mentioned once in this article.,0.002525335643440485,0.0023184800520539284,0.0046551120467484,0.0010163665283471346,0.0008487634477205575,0.0015186960808932781,0.0029704265762120485
[NAME] I still love my [NAME] family too,0.082256019115448,0.008697312325239182,0.010425581596791744,0.9972457885742188,0.005391799844801426,0.006922612432390451,0.0036332460585981607
[NAME] is freaking adorable fight me,0.9942901134490967,0.06740574538707733,0.008029844611883163,0.012935228645801544,0.02157577872276306,0.004016104619950056,0.001560840173624456
I feel safe around you is a nice one,0.9880869388580322,0.0038711961824446917,0.21632282435894012,0.03873103857040405,0.01075589470565319,0.0469544492661953,0.0031873509287834167
He sounds amazing. Congratulations for finding that one!,0.9849503040313721,0.005299780052155256,0.8807629346847534,0.004873109050095081,0.020038872957229614,0.0055019427090883255,0.002523148199543357
I appreciate you taking the effort to respond at such length and with such frequently amidst the degree of misinformation in this thread.,0.9762720465660095,0.002429198706522584,0.3355482518672943,0.002738040639087558,0.008476321585476398,0.0041212826035916805,0.004682451486587524
Would love to get my hands on a dia de los muertos.,0.032222408801317215,0.019922269508242607,0.014039481990039349,0.9961154460906982,0.0030805817805230618,0.006198853254318237,0.002846481977030635
Actually someone already said goodbye so checkmate idiot,0.0024957626592367887,0.02318275347352028,0.006360728293657303,0.00036472425563260913,0.0010940268402919173,0.0026948521845042706,0.06911317259073257
"Same, I still need to sleep to go to work tomorrow.",0.0013352857204154134,0.0019805394113063812,0.0044624339789152145,0.0030351371970027685,0.0023852342274039984,0.009263111278414726,0.01301670353859663
Then people clapped,0.007578485645353794,0.0016739959828555584,0.0037794311065226793,0.0008955157827585936,0.0009972027037292719,0.0013114642351865768,0.0009742869879119098
"Why not hit him up, maybe you can eat some chicken fingers (the good kind, 8 bucks) and then go bang behind the muffler shop",0.005059254355728626,0.004270920529961586,0.0017515986692160368,0.0012616688618436456,0.0005454856436699629,0.0015824444126337767,0.0006564644863829017
Lying by omission,0.0025222913827747107,0.0015717819333076477,0.005473026540130377,0.0011880883248522878,0.0009279117221012712,0.0014730826951563358,0.005319885443896055
What's the source? I love this.,0.08107072860002518,0.009364278055727482,0.011638241820037365,0.9975268244743347,0.005341994110494852,0.007944835349917412,0.004455776885151863
I will help ol' [NAME] the right price,0.02635965496301651,0.0019835983403027058,0.009413857012987137,0.006478665396571159,0.0030389430467039347,0.0029167148750275373,0.0003824977029580623
WE AINT NO RACISTS. EVERYONE CAN BE HATED EQUALLY.,0.023020436987280846,0.0018468034686520696,0.001864014775492251,0.002050341572612524,0.005184884648770094,0.0042622946202754974,0.0006911860546097159
“ nice try”,0.9930315017700195,0.006416594609618187,0.11508249491453171,0.00484327832236886,0.006932651158422232,0.004358577076345682,0.0024484640453010798
"Really wanted him on the Mets. But, its gonna be fun watching [NAME] try to catch [NAME] slider. ",0.040827516466379166,0.9944304823875427,0.004958545323461294,0.004262144677340984,0.002466093748807907,0.0056924400851130486,0.0018597274320200086
I have mixed states and rapid cycling too! Super fun,0.298422634601593,0.9966394901275635,0.013042114675045013,0.010193921625614166,0.008064222522079945,0.014838512986898422,0.0036450393963605165
My love for [NAME] has nothing to do with his Blackpool performance,0.15381655097007751,0.00379444332793355,0.014273424632847309,0.9958199262619019,0.0055624814704060555,0.005031883716583252,0.0032765669748187065
My mom used to throw tantrums in public. I wanted to crawl into a hole and die when she'd start.,0.001315322588197887,0.061301879584789276,0.001373060280457139,0.005009827669709921,0.0007207493763417006,0.0009241082007065415,0.00663786381483078
we need more [NAME] like [NAME] and [NAME]. So far those are the only 2 who I have seen stick to their principles.,0.01281906571239233,0.0010892396094277501,0.002792058978229761,0.002332608914002776,0.001836342504248023,0.0016847002552822232,0.0006971086841076612
She's not pointing at you. Look closer.,0.009619236923754215,0.0021592448465526104,0.0013987941201776266,0.0012262031668797135,0.0009605861851014197,0.0018551022512838244,0.000965719111263752
That would be sick!,0.0018483124440535903,0.00835424941033125,0.001702096895314753,0.0011092731729149818,0.0005507811438292265,0.001388583448715508,0.001977326115593314
It's because you're dizzy from lack of oxygen.,0.0016395358834415674,0.00391083350405097,0.002631125971674919,0.001158855389803648,0.000738896313123405,0.001408386160619557,0.0047361599281430244
"noun flogging or beating, either as a religious discipline or for sexual gratification.",0.002573922974988818,0.002669961890205741,0.003315369365736842,0.001377646578475833,0.0007913577137514949,0.0013196473009884357,0.0029211656656116247
Welcome to Pittsburgh,0.012382064014673233,0.004237382207065821,0.9898002743721008,0.005185212008655071,0.0013742755400016904,0.0045236689038574696,0.004461375065147877
You might be projecting. The team has a great record playing in front of him.,0.9860706925392151,0.007868058979511261,0.012582353316247463,0.0022815761622041464,0.006669461727142334,0.002556529827415943,0.0019051434937864542
"no, mostly just spurred from mild boredom and thinking of the [NAME] future. Getting a gauge at the caliber of players chosen at #12.",0.003918767441064119,0.0016305643366649747,0.003006746293976903,0.0011673265835270286,0.0010075508616864681,0.002413397654891014,0.0018255155300721526
[NAME] who voted for [NAME] I voted for sicko mode,0.007135322783142328,0.002000927459448576,0.0045652990229427814,0.013879015110433102,0.0038706630002707243,0.0024034304078668356,0.0007297932752408087
The fuck is a fortnight? Like the game?,0.008633838035166264,0.014088342897593975,0.0006126646767370403,0.002457271795719862,0.00043708476005122066,0.0006872456870041788,0.00040344655280932784
Tbh not sure why you'd ever keep those two by each other. One above oven other literally almost anywhere else besides above oven,0.0024721715599298477,0.002522736322134733,0.002246931893751025,0.0010667035821825266,0.0007137742359191179,0.0013434643624350429,0.0023316170554608107
"I love the content the PC channel puts out, its what wwe's channel should do more of",0.18668803572654724,0.00546116242185235,0.006070538889616728,0.9956079125404358,0.0039945123717188835,0.004454533103853464,0.0019188071601092815
That Burberry?,0.003243496175855398,0.0031453347764909267,0.0023903523106127977,0.0010675813537091017,0.0005751152639277279,0.0009757380466908216,0.0015772037440910935
[NAME] is a really cool name!,0.992621660232544,0.0076716006733477116,0.0257576797157526,0.0036903643049299717,0.00632517458871007,0.004024161491543055,0.0022915604058653116
"Happiest of birthdays, hope you can share it with the ones you love ",0.020380774512887,0.006064712535589933,0.009563110768795013,0.9874550104141235,0.002120363526046276,0.0040932586416602135,0.001698148320429027
"Cold Stone, I would have been in line",0.0060172067023813725,0.0015486283227801323,0.0030238735489547253,0.001418469357304275,0.0018705148249864578,0.0016543712699785829,0.0015538090374320745
So sorry for your loss.,0.049688685685396194,0.022170020267367363,0.12929143011569977,0.020422644913196564,0.013468161225318909,0.01692063920199871,0.9969117045402527
Thanks. I’m not ok with the behavior I’m.just having a difficult time accepting what I must do.,0.005172959994524717,0.007653986103832722,0.9977855682373047,0.00707530602812767,0.0020889313891530037,0.006428565829992294,0.019478775560855865
I used to use Phillips but I switched to State Farm this year,0.003362440736964345,0.009769735857844353,0.003772864118218422,0.011516647413372993,0.004087495151907206,0.0027868091128766537,0.004737167153507471
Call it an ATATM (automatic teller ATM),0.0028895754367113113,0.005531496834009886,0.002144455909729004,0.0015147633384913206,0.0006139372126199305,0.00095147400861606,0.0012335036881268024
back when mercy could get play of the game.. and not be useless.,0.007687774952501059,0.0007111279992386699,0.007356122136116028,0.0011490564793348312,0.003326058154925704,0.01104797050356865,0.003391803940758109
it's ironic you are identifying with the nazi character lol,0.010602809488773346,0.9948344230651855,0.005664842668920755,0.0038811585400253534,0.0019489661790430546,0.004073662683367729,0.0027591530233621597
